hviske,file
"Lovforslaget bliver nødt til at sige, at det er jo ikke det største lovforslag, vi har haft.Jeg kan godt konkludere på, at når den mesters, mit tal er at sige, at hvis vi nu bare laver loven selv, så vil vi være fri for os tog her i dag, så skal vi bare konkludere, at det kan blive godt klart selv, så vil jeg godt roes mine folketingskolleger i, at juleferien har gjort, at vi har hurtigt ekspedit i folketingssalen, når det ser frem imod.Nye borgerlige kommer til at støtte lovforslaget, så følger vi det vi ser også frem til, hvis der bliver gravet op, at dansk lovgivning nogle gange er bedre end europæisk, men det er jo som parti et sted, vi er ret trygge i at stå, at det er nok EUlovgivningen, der for det meste er noget rod, og de danske folkesindelser, som nogle gange altid har styr på det, det ser vi frem mod, at ministeren begynder at implementere noget mere, vi støtter forslaget, og ser frem mod en lige så hurtig behandling af alle de andre lovforslag, vi får igennem året.",Kim Edberg Andersen_video_40_start_0-15-35
"I vore landskaber er der sket en lempelse, hvis deres kommuner ønsker, at de bestemte nye bydele skal bruge bæredygtige byggematerialer, skal have et lavt, hvad skal man sige, ekstra lavt ressourceforbrug i et byggeri.Så kan vi ikke, via det detail, der står i planloven, sikre det en kommune.Man kan måske godt lide, hvis man går virkelig hårdt til den, så kan man måske sikre, at der er gule tegle på alle husene, og så kan man fastlægge en energiklasse og definere, hvor er energiforsyningen fra.Men man kan ikke gå videre, og hvorfor ikke tillade det?Der er en lang række kommuner i Danmark, som sådan set har ønsket at give plads til, at der opstår mere bæredygtigt byggeri, men det kan bejgsikres gennem en lokalplan, fordi planloven er den, som den er, så der er faktisk brug for en ændring. Så den er, hvad skal man sige, mere indre end hensynet til herregårslandskaber, det sikrer sig ikke det bager til byggeri i byerne.",Søren Egge Rasmussen_video_40_start_2-32-23
"Jamen, altså først at fremme sig er det jo, at Danmark har forpligtigelser til at leve op til de her internationale forpligtigelser, og jeg synes også, det skal ses i en større sammenhæng, hvor vi som lille land nu kan være med til og påvirke beslutninger.Og så har konventioner gennem tiderne jo også givet befolkningen nogle folkeretlige rettigheder, det skal man jo også huske på i forhold til forskellige konventioner.Men jeg vil også godt sige, at jeg har stillet spørgsmål til ministeren omkring hvilke konsekvenser, det vil få, hvis Danmark trotter ud af konventionen, og det afventer jeg så at få svar på på et eller andet tidspunkt fra ministeren.",Brigitte Klintskov Jerkel_video_41_start_4-02-44
"Først og fremmest det her med, at det skulle være en ekstra straf, at politiet over for medier eksempelvis skal redegøre for, om det er udlændinge, der har begået en gruppe voldtægt.Det er det eneste, de skal redegøre for, og det står i forslaget, at det skal ikke være personhenførbart, man skal bare vide, hvem er det, der har begået, hvilke typer af mennesker er det, der har begået denne type kriminalitet, fordi vi jo godt ved, at særlige typer af personfarlig kriminalitet bliver begået af særligt mellemøstlige indvandrere og ikke så meget danskere og vestlige indvandrere. Og så siger ordføreren, at det er ikke folketingets opgave det her. Jo, det er det da, fordi som ordføreren selv nævner, så siger retsplejelovens paragraf otte hundrede atten jo, at det kun er i tilfælde, hvor det handler om at identificere en gerningsmand, at politiet skal opgive sine allemange.Og det er der, vores pointe i dansk folkepsik ganske ingent er, at det er relevant for samfundsdebatten at vide, hvem det er, der begår særlige typer af kriminalitet, når man eksempelvis kan læse en historie om en gruppe voldtægt begået mod en fjortenøje pige. Ordføreren.Altså i pakket på to hundrede og atten, stykke to står der, eller stykke et, nummer to, står der, at det",Mikkel Bjørn_video_44_start_3-07-39
"Jeg husker, at natur og miljø, det er noget, vi deler med hinanden. Så hvad du gør i en kommune, og hvad du undlader at gøre i en kommune, det påvirker også andre kommuner, det gør det også i forhold til biodiversiteten.Så jeg synes, at det er så enkelt, men at det undskyldes.Og for den har fuldstændig ret i forhold til, at der er også lavet aftaler om bymidler og så videre, og det er også noget, vi sætter rigtig stor pris på, at lave de her aftaler.Men igen, det er noget, vi stadigvæk har hånd i hanke med, og vi holder øje med, og vi kan følge, så vi går længere, end at vi også stadigvæk her i folketinget kan tage det over med ansvar.",Birgitte Vind_video_40_start_1-48-19
" på det her område, og derfor er det også svært lovgivningsmæssigt at følge med. Forordningen om kunstig intelligens blev jo sådan set fremsat allerede i tyve to år tyve på et tidspunkt, hvor engang chat-GPT havde fået sit folkelige gennembrud, så derfor kommer lovgivningen jo på bagkant af udviklingen, det er jo meget naturligt, men jeg fastholder, at vi på ingen måde sidder på hænderne og er meget opmærksomme på at yde vejledning og rådgivning i brugen af kunstig intelligens. Og det er også derfor, datatilsynet har udgivet vejledningen til offentlige myndigheders udvikling og brug af kunstig intelligens, og digitaliseringsstyrelsen har altså også udgivet guide til både offentlige myndigheder og til virksomheder omkring brugen af kunstig intelligens.Til både offentlige myndigheder og til virksomheder omkring brugen af kunstig intelligens, så der skæver meget på området i forhold til at vejlede og rådgive både offentlige myndigheder og virksomheder, men for mig er det vigtigt, at den vejledning og rådgivning også bliver ved med at flugte med det, der kommer med kunstig intelligens forordningen, vi kan ikke gå videre end den.",Marie Bjerre_video_41_start_1-22-45
"Fremad synes jeg tak for en god ordførertale, det var jo nærmest et ekkokammer af min egen tale, og det understreger den bredde, der er herinde i folketinget, til at gå seriøst til værds i forhold til konventionerne, det er jeg faktisk rigtig glad for.Vi er jo lidt tilbage i historiebøgerne i denne debat, må vi jo nok erkende, og jeg anerkender, at danmarksdemokraterne er et nyt parti og kan således heller ikke have ansvaret for fortiden. Men jeg vil være lidt tilbage i annalerne, og hvad jeg kan selv sætte mig frem til, så mens der var et borgerligt flertal tilbage i nullerne, der har man jo også stemt for at give rigtig mange mennesker statsborgerskab.Jeg har selv kunnet sætte mig frem til, at fjorten gange, der har dansk folkeparti med Pia Kjærsgaard i spidsen, fru Pia Kjærsgaard, stemmer for, og der er faktisk i de fjorten lovforslag, man har stemmet for, omkring femogtredive tusind mennesker, der har fået dansk statsborgerskab med stemmer fra dansk folkeparti.Jeg bare hører ordføreren, om det ifølge ordførens optik er mange eller få.",Anders Kronborg_video_41_start_3-38-46
"Hvis det datagrundlag, vi har nu, ikke er godt nok, og som i virkeligheden er flere domme end man havde fra to tusind, og til to tusind og to, hvor der blev langt færre dømt for voldsigt og langt færre sigtet, hvis det ikke er godt nok, er det ordføren, som står og siger nu, at der er forkerte sigtelser eller forkerte domme.Jeg prøver bare at forstå, at ordføreren siger, at det grundlag, vi har, er ikke godt nok nu.Hvad er det, der præcist er i vejen med det grundlag?Sker der forkerte sigtelser, eller forekommer der forkerte domme, eller hvad er det, ordføreren prøver at sige, når grundlaget ikke er godt nok til at kunne lave en undersøgelse?",Karina Lorentzen Dehnhardt_video_44_start_4-00-48
"Jeg er enig, vi har en udfordring i forhold til både facilitetsudfordringer, som ministeren nævner med hver fjerde, der har udfordringer, men jo også med en befolkningsvækst, der går den forkerte vej. Men tid er afgørende for sådan et vellykkende facilitetsforløb, og som vi lige var inde på, er der ventetider. Denne ufrivillige barnløshed og facilitetsbehandlinger, det kan nemlig være ekstremt opsliddende, som ministeren også var inde på, og der er grænser for, hvor længe kvinden og parforholdet kan holde til den slags.Det er enormt indgribende at skulle stikke sig konstant, at skulle ændre på cyklussen, at skulle opleve at have skanninger på klinikken aflyst, eller som ændrer sig med kort varsel, for det er noget, der griber ind i hele familien og parforholdet på en ret vild måde.Den her alder hos kvinderne er også en faktor for at have en god chance for succes, og uret tækker jo, og det gør det også, når man begynder i et forløb på en fertilitetsklinik, og den her ventetid kan være gift for sådan et forløb.Forskere har forløb til at være ved at være ved at være ved at være ved at være ved at være ved at være ved at være ved at være ved at være ved at være ved at være ved at være ved at være ved at være ved at være ved at være ved at være ved at være ved at være ved at være ved at være ved at være ved at være ved at være ved at være ved at være ved at være ved at være ved at være ved at være ved at være ved at være ved at være ved at være ved at være ved at være ved at være ved at være ved at være ved at være ved at være ved at være ved at være ved at være ved at være ved at være ved at være ved at være ved at være ved at være ved at være ved at være ved at være ved at være ved at være ved at være ved at være ved at være ved at være ved at være ved at være ved at være ved at være ved at være ved at være ved at være ved at være ved at være ved at være ved at være ved at være ved at være ved at være ved at være ved at være ved at gøre siger, menne gange gange gange gange gange gange gange gange gange gange gange gange gange gange gange gange gange gange gange gange gange gange gange gange gange gange gange gange gange gange gange gande, men det er en løbære, menne gange gange, men det er en løbære, menne gange, men det er en løbære, menne gange, men det er en løbære, menne gange, men det er en løbære, menne gange, men det er en lørdes, menne, men det er en lørdes, menne, men det er en lørdes, mennes, og ministeren var lidt inde på det, men er det stadig sådan, vil venstre gerne udvide både retten til udredning og behandlingsgaranti til også omfattede facilitetsområder.",Louise Brown_video_41_start_0-35-35
"Tak for spørgsmålet.Jeg er enig i, at tallene fra fronttekst understreger, at vi står i en migrationskrise.Vi skal tilbage til to tusind og seksten for at finde et år, hvor der var flere spontane asylsørende, der er i år.Det har enormt store konsekvenser, for det første er der tusindvis af mennesker, som dør på vej over, for det andet bliver rigtig mange mennesker, som egentlig har større asylkrav eller med væsentlig asyl, efterladt i nærområderne. Det er derfor, vi i regeringen arbejder for et nyt europæisk asylsystem, hvor de irregulære migrere bliver stoppet, og ministeriet får en ordnet måde at søge asyl i Europa. Jeg er tilfreds med, at der efter tre års svære forhandlinger her kort før jul blev åbnet enighed om hovedelementerne i den nye migrations og asylpagt.Vi får sikkerhed styrket ved de ydre grænser, der kommer bedre screening, obligatorisk grænsebrugsstyr, bedre registrering af asylsøgere, irregulære migranter, og vi arbejder også for at bekæmpe irregulær immigration og smuglernetværket gennem stykkekontrol med evs ydre grænser.Vi bidrager hvert år fra danmarks side til fronttaks med personel og kapacitetsbidrag i form af blandede fly, helikoptere, patruljebåde, køretøjer til de lande, som ligger i grænsområdene.Men det er vores der klare opvisninger, at regeringen, at derudover de nuværende indsatser har brug for, at forebygge og adressere den irregulær immigration helt grundlæggende, og det er derfor, vi ønsker, at der skal laves en aftale med et tredje land uden for EU.Her er Alexander Rylle.",Kaare Dybvad Bek_video_41_start_0-58-18
"Forslaget fra radikale venstre sætter forudsummet meget centralt, hvis I spørger mig, nemlig kriminalforsorgen og landets fængsler.Det er desværre forholdene flere steder i retssystemet, som skaber de udfordringer, som ligger til grund for beslutningsforslaget og ønsket om kortere varetægtsfængslinger. Sagsplanningstiderne ved politiet, anklagemyndigheden og domstolene kan trække ud, hvilket betyder, at varetægtsfængslingen i nogle tilfælde trænger ud, som følger de lange sagsbanstider.Med den ambitiøse fleresaftale, som radikale venstre selv var med i for domstolene fra tyve tre og tyve, kan vi forhåbentlig komme med stor del af udfordringen til livets.Med flere dommere og jurister skal sagsbanstiden springes ned, og det kan forhåbentlig også nedbringe varigheden af varetægtsfængslingerne.En anden del af beslutningsforslaget indebærer, at man kigger ind i, at begrænse antallet af varetægtsfængslinger.For os i moderaterne er det vigtigt at slå fast, at varetægtsfængslinger står som et centralt element for både retsfølelsen og retssikkerheden i Danmark.Det vigtige er eksempelvis personer, som er sigtet for grove forbrydelser, ikke render frit rundt på gaden og potentielt møder dem, som har anmeldt dem. Derudover så bliver der ikke varetægtsfængslet, med mindre at der er et sådant proportionelt indgreb, som så at sige matcher længden af en forventet straf samt en sigtets personlige forhold. Og der er det sådan, at femogfirs procent af de varetægtsfængslede ender faktisk også med at få en ubetinget straf efterfølgende i forbindelse med en retssag.Vi har tilskuet til, at domstolen træffer de rigtige beslutninger omkring varetægtsfængslinger, så vi eksempelvis undgår, at sigtede personer begår ny kriminalitet. Og det skal egentlig også nævnes i forlængelse af det, at antallet af varetægtsfængslinger også er falede med over tyve procent inden for de seneste fem år.Når det er sagt, så hilser vi immoleraterne forsatsstillernes budskab omkring alternativer til varetægtsfængsling. Velkommen.Immoleraterne vil særlig optage, at først og fremmest at forebyde kriminalitet, og dernæst at sikre bedre resocialisering, så vi som samfund undgår, at personer falder tilbage til ny kriminalitet.Her er det særlig vigtigt, at vi retter fokus for os at se mod unge lovovertrædere mere, end vi gør i dag, og at vi også retter fokus på førstegangskriminelle, altså folk, der ikke er tidligere straffe.I forhold til den gruppe vil vi gerne se ind i mulighederne for eksempelvis, at man kan få fodlænke på i stedet for at blive varetægtsfængslet, og i det hele taget også kan afsone efterfølgende med fodlænke.For med de kapacitets- og mandskabsproblemer, vi har i kriminalforsorgen, så synes jeg faktisk, at det gik ganske god mening. Og det håber vi også flere partier villige til at kigge ind i, når vi i første halve år og tyveogfyrre skal have videre drøftelser omkring varetægtsfængslinger.Og vi ser frem til videre drøftelse omkring varetægts fængslinger.Så i moralen deler vi sådan set radikales bekymring omkring den stigende varighed af varetægts fængslinger, og vi ser frem til videre drøftelse omkring det.Men på nuværende tidspunkt kan vi ikke støtte beslutningsforslaget.Tak til ordføreren, der er en kort bemærkelse for scenens samme radikale venstre, værsgo.",Tobias Grotkjær Elmstrøm_video_44_start_5-25-58
"Nej, og det er faktisk heller ikke det beslutningsforslaget her handler om. Det handler om at lave nogle retningslinier, som faktisk bliver efterspurgt derude, der bliver efterspurgt fra virksomheder, der bliver efterspurgt fra kommuner, der bliver efterspurgt fra skoler, hvor de siger, kan jeg ikke hjælpe os med nogle retningslinier.Hvad skal vi gøre, hvis vi skal få en løn?",Lisbeth Bech-Nielsen_video_41_start_1-23-48
"Det er jo vores generelle opfattelse, at loven, som den er i dag, allerede kan håndsere de ufordringer, som der er. Så kan man så måske kiteringen af ressourcerne, fordi der er så meget forurenet jord, at nogle gange er man nødt til at prioritere, hvor er det, man sætækkeligt, og så er vi åbne for at kigge på den anden del af SFs forslag.",Alexander Ryle_video_40_start_3-45-24
"Jeg er så set ind i, at det kan man allerede gøre i dag, og når der kommer individuelle ansøgninger om at bygge boliger eller erhverv, eller kombination for den sags skyld, så viser man jo et skyldigt hensyn til alle de faktorer, der gør sig gældende både i området, det kan være lokale planer, det kan være registreret fortidsproblemer herunder i åbens forhold og alt muligt andet, og så er det jo også sådan, at når man eventuelt ender med at give en byggetilladelse, så kan man jo også stille nogle krav i forhold til at være i forhold til at være i forhold til at være i forhold til at være i forhold til at være i forhold til at være i forhold til at være i forhold til at være i forhold til at være i forhold til at være i forhold til at være i forhold til at være i forhold til at være i forhold til at være i forhold til at være i forhold til at være i forhold til at være i forhold til at være i forhold til at være i forhold til at være i forhold til at være i forhold til at være i forhold til at være i forhold til at være i forhold til at være i forhold til at være i forhold til at være i forhold til at være i forhold til at være i forhold til at være i forhold til at være i forhold til at være i forhold til at være i forhold til at være i forhold til at være i forhold til at være i forhold til at være i forhold til at være i forhold til at være i forhold til at være i forhold til at være i forhold til at være i forhold til at være i forhold til at være i forhold til at være i forhold til at være i forhold til at være i forhold til at være i forhold til at være i forhold til at være i forhold til at være i forhold til at være i forhold til at være i forhold til at være i forhold til at være i forhold til at være i forhold til at være i forhold til at være i forhold til at være i forhold til at være i fordel i fordel i fordel i fordel i fordel i fordel i fordel i fordel i fordel i fordel i fordel i fordel i fordel i fordel i fordel i fordel i fordel i fordel i fordel i fordel i fordel i fordel i fordel i fordel i fordel i for",Hans Kristian Skibby_video_40_start_3-41-16
"Men jeg ved jo også nogle af de organisationer, som er nævnt i beslutningsforslaget, er jo i fuld gang.Der bliver jo sat hegnspæle op hele tiden, allerede nu.Og når vi allerede kan se rammerne for det, vi skal udmønne i forhold til e-reguleringen, så kommer detdeleren siger det forsås, at de relevante ministerer straks formulerer retningslinier til forskellige dele af samfundet og så videre, erhvervsmilisteriet bør eksempelvis udarbejde retningslinier til landets virksomheder, så har jeg lidt behov for at vide noget mere om, hvad er det de retningslinier skal indeholde, og hvad skal ministeren egentlig arbejde ud fra, når de også ønsker at tage afsæt i de kommende æg i reguleringer.",Mona Juul_video_41_start_2-03-53
"Kristina Olomego-Raffaella, der er blevet kortet ved mærkningen, så vi siger tak til ordførerne.Og da der ikke er flere, som har bedt om ordet, er forhandlingen sluttet, og jeg foreslår, at fortsættet henvises til indenrigsudvalget, må sengøre indsigelsesbetragter i dette som vedtaget, og det er vedtaget.Og så er vi klar til det næste punkt på dagsordenen, det er punkt seks, og det er førstebehandling af beslutningsforslag nummer B, fireoghalvfjerds, var det forslag til folketings beslutning om forbud mod byggeri oven på affaldsdepoter og kemiske hotspots og om modernisering af jordforureningsloven, hvor det er a, majanne, bigum, sf og sine munk.",Erling Bonnesen_video_40_start_2-57-57
"Beslutningsforslaget, som vi skal drøfte i dag, er både relevant og nødvendigt.Vores nuværende viden om gerningspersoner i voldsagssager, det sammer fra en undersøgelse tilbage fra to tusind og ni, der lal lidt ligesom at bruge en gammel mobiltelefon i en verden af smartphones, det virker bare ikke længere.Der er sket en markant stigning af antallet af anmeldte voldsagssager, og vores samfund har ændret sig siden to tusind og ni.Vi har nye love som samtykkelovne fra tyveogtyve, og metoobevægelsen har også haft stor indflydelse.Det betyder, at vores nuværende tilgang, baseret på de gamle data, simpelt hen ikke er opdateret nok.Vi har ro for at forstå, hvem gerningspersonerne er i dag, og hvad der driver dem.Med en stigende kompleksitet og ændringer i anmeldelsesmønster er det nødvendigt at få en opdateret vurdering af situationen.Det handler ikke bare om statistikker, det handler om at beskytte vores samfund bedst muligt. Nu nævnte jeg sampsykeloven tidligere, og den er også vigtig i denne sammenhæng. Vi kan ikke ignorere, hvordan indførelsen af sampsykeloven i tyve tyve har påvirket antallet af anmeldelser af voldsseksager. Sampsykeloven var en milepæl, der ændrede den måde, vi ser og definerer voldsseks på. Men med forandring så kommer udfordringer.Undersøgelser har vist, at fire ud af ti unge mænd har svært ved at afgøre, om der er det fornødne samtykke til sex, siden loven trådt i kraft.Det betyder, at samtykkeloven ikke kunne have ændret spillereglerne for retsforfølgelse, men den har også skabt en vis usikkerhed og forvirring omkring samtykke.Derfor er det afgørende, at vi forstår, hvordan samtykkeloven har formet dynamikken i anmeldelsesmønster, så vi kan tilpasse vores tilgang til at håndtere voldsækssager.En ny undersøgelse vil give os nødvendig indsigt og bidrag til at sikre, at lovgiverne ikke blot er et stykke papir, men også en effektiv vejledning for retfærdigheden.Så med det sagt, så støtter danmarksdemokraterne naturligvis forslaget.Og der er ingen kort bemærkelse, tak chef, hubertina Kaspjær.",Betina Kastbjerg_video_44_start_4-22-20
"Ja, fordi det afgørende problem i den danske facilitetsbehandling er for mig at se ikke antallet af forsøg, eller at man selv skal betale for nummer to forsøg, lige nu der er det store problem, de ventetider der er, og at man også kan opleve at blive afmeldt i sådan en behandling i flere måneder, simpelt på grund af manglende kapacitet.Og det må jo være frygteligt, når man så ved, at der netop er muligheder derude netop i de private, som jo i dag også faktisk varetager over halvdelen af de fertilitetsbehandlinger, der er i vores land. Så det er gældeligt at høre, at ministeren gerne vil kigge på det her område.Hvornår skal vi så i gang med det?",Louise Brown_video_41_start_0-37-58
"Han har svaret, forlåret det råd, så er vi jo netop i gang med forhandlinger, og vi har haft to forhandlingsmøder om det konkrete element, der vil levnes, nemlig nulemissionssoner, og give mulighed for at lave lovforslagelse, at lave en stemmeaftale, præcis forhandlinger om at give mulighed for, at kommunerne får frihed til at indføre dette, af hensyn til klimaet og den grønne omstilling i vores transportsektor, og selvfølgelig også nogle luftkvalitetshensyn. Så vi er i gang med forhandlinger, men forhandlinger, synes jeg, skal være om nogle reelle forhold til, at de nye regeringer skal være formentlig i forhold til, at de nye regeringer skal være formentlig i forhold til, at de nye regeringer skal være formentlig i forhold til, at de nye regeringer skal være formentlig i forhold til, at de nye regeringer skal være formentlig i forhold til, at de nye regeringer skal være formentlig i forhold til, at de nye regeringer skal være formentlig i forhold til, at de nye regeringer skal være formentlig i forhold til, at de nye regeringer skal være formentlig i forhold til, at de nye regeringer skal være formentlig i forhold til, at de nye regeringer skal være formentlig i forhold til, at de nye regeringer skal være formentlig i forhold til, at de nye regeringer skal være formentlig i forhold til, at de nye regeringer skal være formentlig i forhold til, at de nye regeringer skal være formentlig i formentlig i forhold til, at de nye regeringer skal være formentlig i formentlig i formentlig i formentlig i formentlig i formentlig i formentlig i formentlig i formentlig i formentlig i formentlig i formentlig i formentlig i formentlig i formentlig i formentlig i formentlig i formentlig i formentlig i formentlig i formentlig i formentlig i formentlig i formentlig i formentlig i formentlig i formentlig i formentlig i formentlig i formentlig i formentlig i formentlig i",Magnus Heunicke_video_40_start_1-31-38
"Jeg vil gerne lige allerførst sige, at hvis det skulle have været en god og grundig gennemgang fra socialdemokratens ordfører, så er det andre gang, hvor jeg har oplevet dem endnu mere grundige, vil jeg i hvert fald gerne sige, men jeg anre retsgrundlag i forhold til, hvis de bliver omfattet af miljøskader. Og det er jo sådan, at hvis man kigger på evokommissionen, så har de jo konkluderet, at dele af det her miljøansvarsdirektiv, det ikke var tilstrækkeligt gennemført i Danmark, og ikke klart pressiserede, hvad regler og vilkår der var i forhold til den enkelte borger?Det er det, der forsøges at genoprette, eller genoprette med bevindelse med det her lovforslag, og det støtter danmarksdemokraterne.",Hans Kristian Skibby_video_40_start_0-08-46
