hviske,file
"Nu bliver jeg ikke så berørt, at det ordføreren siger lige nu, fordi jeg ved, at ordføreren kender mig godt nok til, at vagtafgange, det er nok ikke lige det, der ligger i min DNA.Det jeg opfordrer til, det er, kom med nogle konkrete, mere, flere konkrete eksempler, lad os få sat ind, fordi der er jo ikke nogen herinde, der er uenige i, at vi skal sætte ind på alle parametre, som vi kan, i den krise, vi er i lige nu.Så kom man nu konkret, der er ikke noget, der bliver fejret af bordet, vi tager det hele op, der bliver arbejdet hårdt og konstruktivt over fra ministeriets, så kom med jeres forslag.",Charlotte Bagge Hansen_video_40_start_2-08-20
"To ting vil jeg sige i forhold til det her med at styrke sprogstøttens sprogsscreeningen, og der har også været tidligere aftaler tilbage i tid omkring styrkelse af, hvordan vi indretter danskundervisningstilbuddene, og treparten for treogtyve blev der afsat en pulje til særlig indsats for fastholdelse af elever, også med fokus på sprogstøtte.Næste korte bemærkninger til fru Kirsen Norman Andersen, sf.",Mette Kierkgaard_video_44_start_6-21-56
"Der er fremskridt, der er også andre fremskridt omkring for eksempel de forhandlinger, der har været i OECD, omkring fælles minimumssatser, som jo også er en måde at komme noget af det her til livs, og de her forskellige mekanismer, som man arbejder på at indføre for at kunne beskatte de virksomheder, som ikke bliver beskattet ordentligt der, hvor de er hjemmehørende. Så internationalt samarbejde både i EU og i OECD er jo helt afgørende for at få gjort noget ved det her, der er svært at gøre som et enkeltland, selv om vi kun tager initiativ af i Danmark også. Så det er positivt. Problemet er, at de kriterier, at EU bruger for sortliste, er relativt limpelige, og det vil sige, at nogle af de lande, der bliver taget af listen, kan man godt diskutere, er de rent faktisk ikke stadigvæk skattelødelande, ogene, og er de stadig en belastning af vores evne til at kunne indkræve de skatter, som vi bør for de selskaber, som tjener penge på operæet i Danmark.",Pelle Dragsted_video_41_start_2-47-30
"Det er jeg glad for ordførerne er klar på, fordi det betyder netop, aviser og netop, at vi jo godt kan gå ind og se på at give kommunerne nogle lempelige regler, hvis vi ellers sætter os ned sammen. Og det er jo sådan set det, det hele handler om. Det, jeg synes, er lidt ærgerligt, at ordførerne så bevæger sig ud i, det er at kalde regeringen magtfuldkommen. Jeg ved ikke, om det var det præciste ord, det var sådan, jeg tolkede det. Jeg synes, det netop bliver lyttede, jeg synes jo netop, at vi sætter os ned og får lave, brede aftaler, så vi er da ved at enes os med nogle af de meget brede aftaler, vi laver, femogfirs procent af de aftaler, vi laver her i folketinget, er på tværs af folketingssagen.",Birgitte Vind_video_40_start_2-33-22
"Hvad skal jeg trykke på?Sproget er en kompetence, men at det i lige så høj grad også er en kompetence at kunne udøve omsorgen. Så egentlig bare, inden ordførslen bliver lagt sådan, alt muligt i munden med det frie marked og andre ting, egentlig bare bed ordførslen uddybe, hvad der var intentionen i talen. Ordfør. Jamen, intentionen i talen.",Mai Mercado_video_44_start_7-13-12
"Og om et byggeri eller etablering af infrastruktur kan finde sted, bør som dør sker i dag, foretages på et konkret, projektspecifikt grundlag og på baggrund af en dokumenteret risikovurdering.Et generelt forbud vil potentielt øge omkostningsniveauet ved nye etableringer af byggeri og infrastruktur fremadrettet, og i forbindelse med håndtering af jordforureningen er det generelt vigtigt med en hård prioritering af ressourcerne, mod fremtidige risiko og mulighed for opretning uden øgede omkostninger helt i henhold til den eksisterende jordforureningslov.Derfor mener vi i liberal alliance, at SFs forslag om et generelt forbud er en meget ufleksibel løsning på et problem, som der allerede findes lovgivning om.Men hvis jeg alligevel skal vise en vis form for åbenhed i forhold til det forslag, som SF er kommet med sig, så synes jeg ueniglig, at der er nogle dele, for eksempel det her med ensartet krav til, hvor højt indendørsluftens indhold af kemikalier må være, som godt kunne give god mening at kigge lidt på igen, fordi, som ministeren jo var inde på, så har man valgt at prioritere drikkevand, natur og menneskers sundhed, men vi bruger også mange timer på vores arbejdsplads, så derfor synes jeg jo også, at der bør være en høj kvalitet af luften der, fordi det jo også påvirker sundhed og sikkerhed. Så med en lille åbning for dele af forslaget, men altså, vi kan ikke støtte det samlede forslag, primært på grund af forbudselementet, som er lidt for riggede til vores mag.",Alexander Ryle_video_40_start_3-42-15
"Jeg vil sige, det spørgsmål, som der rejses her i forhold til udenlandsk arbejdskraft, skal selvfølgelig også vejes ind i den videre proces med det her forslag, det tænker jeg sådan set er en helt naturlig del af det, jeg synes, som ministeren var inde på, at man med rette kunne kigge mod for eksempel løllande, som har gjort sig gode erfaringer, og tage imod udenlandsk arbejdskraft allerede.Og der er i hvert kort bemærkninger tak til fru Fie Hækkerup, socialdemokrat,",Fie Hækkerup_video_44_start_6-37-21
" offentligt mange gange, at da jeg var helt ung, der havde jeg et idolplakat af fru Pia Kjærsgaard hængende på mit værelse. Danmarks hjemmehjælp stod der, fordi jeg har nemlig også altid kæmpet for hjemmeplejeren, det har fru Pia Kjærsgaard også gjort. Så tak for det. Når det så er sagt, så synes jeg, der var sådan en lidt kedelig ordveksling tidligere i dag foranledig af, at fru Pia Kjærsgaard stillede mig et spørgsmål, mens jeg var på ordførstolen. Og når jeg nu tager det op igen, det er fordi, jeg synes, at fru Per Kjærsgaard stillede det rigtige spørgsmål til mig. Jeg synes, at Per Kjærsgaard skulle have stillet det spørgsmål til mig, om hvad det er, at danmarksdemokraterne så vil stemme til det her lovforslag, eller det her beslutningsforslag, hvis det kom til afstemning. Og så havde jeg sagt, så stemmer vi for. Men det undlod for Pia Kjærsgaard og stillede spørgsmål, det synes jeg bare er hamrende ærgerligt, og derfor vil jeg gerne lige sige det, at vi stemmer altså for, at danmarksdemokraterne det mandat har jeg fået af folketingsgruppens tillad til. Ordfører. Jamen, det må jeg altså sige, det synes jeg i den grad burde have været",Marlene Harpsøe_video_44_start_7-30-37
"Hvad er det, der er vigtigst for os?Og der bliver kort bemærkelse, tak til de amerikanske konservative folkepartier.",Mai Mercado_video_44_start_3-35-25
"Tak for ordet, formand.Hvis man følger debatten derhjemme, så kan man godt få indtryk af, at det her er en ren ekspeditionssag, og at vi er enige i folketinget. Og det sidste vil jeg bekræfte, jeg tror, vi er enige, at selvfølgelig opdaterer vi listen over lande på den danske defensive foranstaltninger i forhold til skattelyen og EUs skattelyliste også gør det.Jeg vil lige knytte et par ord til EUs skattelyd eller liste over skattelivanden, dels fordi listen er mangelfuld, og dels fordi den så også faktisk kan have en effekt.Når listen kan have en effekt, så er det jo fordi, at den lægger et pres på de enkelte land i forhold til atke virksomheder, som har investeret i det land, så er formentlig ikke til at forstå.Det andet er jo så, at EUs liste desværre er stærkt mangelfulde, og det er den først og fremmest fordi, at europæiske lande ikke kan optræde på skattelysningen, selv om vi ved fra utallige læg, at der er klare skattely i Europa, man kan nævne Luxembourg som et af dem.Det er lande, som slås op på og sikrer, at virksomheder betaler end for lav skat, ikke udveksler skatteoplysninger med andre europæiske skattemyndigheder, og som derfor på alle måder lever op til kravene til at være på listen over skattelyanen. Det bør ændres, det kan vi ikke gøre her for folketinget, det er et spørgsmål i EU, men det er problematisk. På samme måde så ved vi også, at der er en række skattely uden for EU, som heller ikke er opført på listen, og det er skattely som Cayman Island og Bermuda, som har utallige læg og utallige eksempler på, at der bliver spekuleret i skatten. Så i SF så støtter vi selvfølgelig, at vi opdaterer den danske lovgivning i forhold til hvert fald nogle lande, der skal have sanktioner.Det indbefatter, som ordføreren for venstre, Hakeem Valentin, siger selvfølgelig også, at de lande, der nu lever op til kravene, bliver flyttet ud af dem, der skal have sanktioner, og samtidig så er vi stadig kritiske over for, at EUs skattelist ikke er fyldt skøren.",Sigurd Agersnap_video_41_start_2-35-17
"Jeg vil stille spørgsmålene til beslutningsforslaget, også fordi selv om jeg synes det usædvanligt, det er et dårligt beslutningsforslag, så bliver jeg begyndt til at sige, hvor konkret nogle beslutningsforslag er, at moderaterne mener, vi skal komme med, før vi kan få lov til, at moderaterne synes det en god ide, hvor konkret skal vi være, at den næste gang, at de radikale venstre kommer med et beslutningsforslag på de grønne områder, så skal de sige på matrikelnummer D og D i den og den kommune, der ønsker vi, at det her bliver endret.Eller kan man gøre det sådan mere generalistisk og sige, at inden for den her kommunegrænse, synes vi, at der er det ok at lave bedre vilkår.Eller er det simpelt for generalistisk, inden for de otte halvfems kommunegrænser.",Kim Edberg Andersen_video_40_start_2-15-42
"Jeg er så presset for den anden flåg her, jeg tror, jeg står fast på mit synspunkt, og det gør jeg af den grund, at jeg synes, det ligger faktisk også lidt i spørgerens kommentarer og begrundelser for spørgsmålet, fordi enfamiliershuse vadser med tofamiliershuse, altså, jeg synes ikke, der er meget logik at hente ved at gå den vej, logiken vil være for mig selv, og det vil også være den opskrift, at den rette snor, jeg synes, vi skal følge fremover, når vi skal videre, at den vej når markedet, og det er vi jo så enige omige om, bliver bygget op, og det bliver nogle værdier, man har, for det faktisk kan være en værdie at sælge videre, det man får brudt ned på sin grund.Men der vil det også være kvadratmeter, nu er det så startet med to hundrede halvtreds kvadratmeter, når man vil gå længere ned, så vil det også være, synes jeg, klogest og det reneste snit, og nemmest at forstå for alle håndværker og nedrivningsvirksomheder, grundejer og så videre, perlmeterregler, når den, synes jeg, vi skal holde fast i.",Magnus Heunicke_video_40_start_1-14-14
"Jeg siger her, det er nemlig rigtig, rigtig vigtigt i hverdagen for de ældre borgere, fordi man skal jo prøve at satse sig i deres situation.Man er måske blevet svækket med alderdommen, man har fået nogle skavanker, man kan ikke foretage sig de samme ting, som man kunne før, så man har ikke brug for flere udfordringer, blandet ikke i forhold til, om man rent faktisk kan forstå det plejepersonale, der kommer og skal give en den hjælp i den sårbar situation, som det er, man står i. Ordføreren? Jamen, det vil jeg bare sige.",Marlene Harpsøe_video_44_start_6-48-03
" at være andre bagvedliggende forklaringer. Jeg vil bare være meget, meget, meget tilbageholdende med at konkludere, at det fordi vi nødvendigvis varetægtsfængsler for meget, det kunne for eksempel også godt være, at man i Sverige varetægtsfængslet for lidt i forhold til de enorme kriminalitetsudfordringer, som man har derovre, og derfor er jeg bare meget varsom med at konkludere skarpt på, at svaret på denne her problemstilling her, denne her helt åbenlyste udfordring, fordi det er jo klart, når man har eksempelvis i vesterfængsel et belæg, så er det for karimelorensen det ene harde socialistis folkparti.",Peter Hummelgaard_video_44_start_4-59-30
"Jamen, tak for det, og tak, synes jeg, også for en tale, der fører os lidt tilbage i historiebøgerne, og man skal selvfølgelig også tilbage i historien for at der er for at være forholder sig sådan.",Anders Kronborg_video_41_start_4-33-32
"Det er en forfald, blasfemiparagraf i Danmark, der blev afskaffet nogle år siden, og regeringen har igen indført den.Det, regeringen har gjort, yderligere med opbakningen i folketinget, som jo ikke skal deponere, går jeg ud fra sin holdning hos nogle organer nogle steder, det er et målrettet indgreb for at afværge en helt konkret situation, hvor det de facto var sådan, at der fandt daglige systematiske krænkelser sted, og det kunne stort set isoleres til noget, der skete i Danmarkers vejrd i den situation, vi har forholdt os til?Jeg må bare sige igen, jeg har intet sted, og heller ikke i Washington, mødt kritik i den måde, den danske regering håndtede denne årsag på.",Lars Løkke Rasmussen_video_41_start_0-13-19
"Det, man måske mere efterspørger, det er, at medierne i højere grad beskriver etnicitet og herkomst fra de dommefelte, det er jo sådan set ikke, det er jo sådan set i folketingets bord her.Jeg må gøre opmærksom på, at retsplejen i Danmark, som aldrevejende udgangspunkt er offentlig, at domme er offentlige, det er flere hundrede år siden, vi havde hemmelige domme, og skulle man være helt i tvivl, kan man gå sig en tur på.I byretten og kik på retslisterne, så får man jo også set, hvem det er, der er tiltalt, og det tror jeg, det kræver megen fantasi at finde ud af, er herkomsten i givet fald, så der er jo ikke noget, der holder skjult, men det, man ønsker, er måske, at der ligesom skal skrives et manuskript til aviserne, det må pressen have sig selv findet ud af, efter min mening. Og så vidt jeg kan se på forslaget her, så indebærer det to ting, nemlig at man ønsker, at politiet altid oplyser et pressissignalement ved udgivelse af døgnrapporter eller omtale af specifikke hændelser, det er den en anledning, der skal være forløbende, men det er en anledning, der ikke kan straffes på normal vis, det kan være mentalt handicappede personer og lignende, som så pludselig der skal et præcis sine allemange ud af, og det til trods for, at politiet sikkert udmærker ved, h, det er jo det, der står i retsperiodens paragraf otte hundrede og atten, det er jo et efterforskningsskridt, som justitsministeren jo også var inde på, hvis man ved hvem det er, så er det jo ikke det, man skal diskutere.Så jeg vil nok sige, at forslagets første lede betyder altså, at der skal sige en alleman af alle gamle som ældre, og også dem, man i forvejen ved hvem er, men er dem så ikke ude på at give en ekstra straf, er det ikke det, vi skal lave om på, så i givet fald, hvis det er det, der skal diskuteres.Det andet element har det, det er, at regeringen skal udarbejde initiativer, som sikrer, at politi domstoler journaliserer et præcisignalement af anholdte, mistænkte, sigtede, tiltalte og dømte.Jeg kan kun sige til de partier, som ellers mener, at domstolene fungerer, at det er rimeligt langsomt, og det tror jeg nok, at de fleste af os mener, at hvis dommerne skal belastes med det her arbejde oveni, så skal vi løse den.Så derfor mener vi ikke, at der er behov for det, der anføres i beslutningsforslaget, og det får derfor ikke venstres stemme.Han kører bemærkning til herrer Mikkel Bjørn, dansk folkepræsid.",Preben Bang Henriksen_video_44_start_3-04-20
" ikke det er så nogle udtryk, der vil kendetegne den nye ældrelov, som bliver lagt på bordet, for så kan jeg sige på forhånd, så står dansk voldsparti af. Altså, en ældrelov skal indeholde noget, som man kan forstå, flersprogspædagogik, altså jeg må bede ordføreren om at glemme det ord, og så sige stadigvæk, at de nationale standarder, jamen, det har jo ikke spor at gøre med bureaukrati, eller tværtimod, vil jeg sige, dette er den nationale standard på, at man skal kunne sproget, tværtimod, det er af bureaukratisering. Hvorfor?",Pia Kjærsgaard_video_44_start_6-33-24
"Det er faktisk en lidt unik situation i Danmark, for vi har fået en midterregering bestående af tre forskellige partier, og det er ikke min opfattelse, at de enkelte partier, der lige nu er i regeringen, egentlig har ændret deres politik, når det kommer til udlændingeområdet, men til gengæld er gået på kompromis i forhold til de politiske afgørelser og i forhold til de udspillelser, som kommer fra regeringen af.Hvad er skolens spørgsmål?Det er fuldstændig rigtigt.",Sandra Elisabeth Skalvig_video_41_start_3-54-25
"Det er jo fair nok, man er uenige i, at man skal bruge mere tid til at få flere domme, hvis ikke at formalitisen nu på den korte tid her er blevet tilhænger af, at vi skal have med viden om den her lovgivning med udgangspunkt i, og finde ud af hvordan vi kan gøre noget.Der er ikke noget, der tyder på, at den kritik, som formalitisen rejser i forhold til det her lovforslag, har noget på sig.Der er både kommet en vurdering fra faristadvokaten og fra statsadvokaten, og den er jeg meget, meget tryg ved at læge dem opad.Spørgeren.",Bjørn Brandenborg_video_44_start_4-03-31
"Vi har simpelt hen ikke nogen problemer med straffel i eneslisten, og nu er herre Mikkel Bjørn jo medforslagstillet på et forslag, vi skal diskutere hende i morgen, som også handler om en straf, og jeg er til hverdag også retsordfører i eneslisten, og i morgen tænker jeg, at jeg lige kan lægge en lille post-it ned hos herre Mikkel Bjørn, så han kan se, hvor mange gange eneslisten har været med til at hæve straffene for for eksempel økonomisk kriminalitet, for for eksempel digitale krænkelser, men det kan godt være, at herre Mikkel Bjørn heller ikke kan læse det, det skal jeg jo ikke kunne svare på.",Rosa Lund_video_41_start_4-11-30
"Jeg er ikke til at løse de sproglige, svage elever.Næste korte bemærkninger til fru Marlene Hapsø, danmarksdemokraterne.",Fie Hækkerup_video_44_start_6-34-02
"Jeg mener faktisk, at vi har en meget stor opgave i at hjælpe og vejlede og rådgive vores virksomheder i brugen af kunstig intelligens.Men der hvor uenigheden opstår, det er, om vi skal anlægge et udvidet forsigtighedsprincip i forhold til kunstig intelligens forordning.Jeg mener, at det vejledning og rådgivning, vi giver vores virksomheder offentlige myndigheder, de skal følge forordningen, og hvad enden for rammer det, vi kan ikke begynde at lave nogle andre retningslinier eller tillægge et andet princip, som ikke flugter forordningen.Folkningen er jul, det konservative folkeparti, værsgo.",Marie Bjerre_video_41_start_1-24-29
"Mange tak.Tak til dansk folkeparti for at rejse en interessant debat.Danmark har som lille land forpligtet os internationalt ved at have tilsluttet os flere konventioner gennem tiderne, som giver borgerne nogle folkeretlige rettigheder. som giver borgerne nogle folkeretlige rettigheder.I det konservative folkeparti mener vi, som vi hele tiden har sagt, at kriminalitet absolut ikke skal premieres med et dansk pas.Derfor er vi, som forslagsstillerne giver udtryk for, også meget frustrerede over, at det ikke er muligt at fratræde kriminelle personer som voldtægtsforbrydere og seriekriminelle dansk statsborgerskab som konsekvens af deres kriminalitet.Derfor har vi os, af flere omgange, opfordret ministeren til at udfordre konventionerne og undersøge, hvad vores handlerum inden for konventionerne er.Jeg har også stillet spørgsmål til ministeren om, hvilke konsekvenser det vil have, hvis vi trotter ud af statsborgerretskonventionen.Og vi har i flere omgange været med til at få strammet kravene for at få dansk statsborgerskab og vil gerne drøfte yderligere stramninger.Regeringen har jo selv skrevet i sit regeringsgrundlag, at vi skal afklare danmarks manøvrerum i forhold til kommissionerne, og det synes jeg, vi skylder danskerne, og jeg venter stadig på den afklaring.Vi skal også huske, at det er socialdemokratiet, der tidligere har foreslået, at statsborgerskaber skal kunne frakendes ved personfarlig kriminalitet, noget som konventionerne også har sat en stopper for. Senest har socialdemokratiets udlændingeordfører, herre Frederik Vad, udtal sig i negative vendinger om konventionerne, så jeg synes ærlig talt, at vi har hørt nok snak. Lad os se at få afklaret vores manøvrerum i forhold til konventionerne, så vi kan stille Danmark og danskerne i den bedste position. Når det så er sagt, så er vi ikke der, hvor vi på baggrund af beslutningsforslaget her vil udtræde af statsborgerretskonventionen.Alt skal gå ordentligt til, og Danmark skal naturligvis leve op til internationale forpligtelser.Men lad os nu udfordre og undersøge vores handlerum, som jeg har opfordret til, og som jeg håber på, at regeringen og ministeren vil handle på.Tak for ordet.Ja, tak, og der er lige en kort bemærkelse.",Brigitte Klintskov Jerkel_video_41_start_3-58-41
"Tak for ordet, og tak til forslagsstillerne.Der er jo ikke nogen tvivl om, at vi de her år har brug for både at udvikle og tøjle kunstig intelligens.Fortsat her, det er adresseret den rivende udvikling, vi er i, og fokuserer på nogle af de restriktioner, som der kan være behov for, nemlig at der foretages risikovurderinger med forskellige typer sagsbehandlingers anmeldelse af kunstig intelligens, at der udarbejdes retningslinier for virksomheders og myndigheders anmeldelse af kunstig intelligens, og at der skrives retfærdighedsprincipper for anmeldelsen af den nye teknologi ind i produktansvarsloven og forvaltningsloven.Det er langt hen ad vejen rigtig fint, men grundlæggende er det svært at forstå behovet på beslutningsforslaget, for som forslagsstillerne også selv bemærker, er der i uregulering på trapperne, det er der flere ordførere været inde på, ministeren var det også selv.Reguleringen kan netop adressere, hvor der skal trædes på bremsen, og som ikke giver megen mening at lave national lovgivning på, tænker vi.Hvis en engang vil det også være helt afgørende, vil vi få en grundig drøftelse af, hvad der ligger i blandt andet retfærdighedsprincippet, ordførerne for forslaget har jo spurgt flere om det, at, hej, måske skal vi bare kigge på det, måske skal vi bare have en drøftelse af det.Og det er en lille lille lille lille lille lille lille lille lilleel overveje at slippe nogle flere data, ikke følsomme data, løs som træningsdata.For for eksempel at få chatbots af høj kvalitet og troværdighed skal der bruges træningsdata af høj kvalitet og troværdighed.Dammers radio har masser af egenproduceret kvalitetsindhold, som jo allerede er betalt, af skattekroner, men DR har valgt at blokere for, at robotter kan læse og lære med. Det er et sted, hvor vi kunne kigge på det. I Japan har man en væsentlig mere liberal tilgang, det kan være lidt for voldsomt, men der er i hvert fald mulighed for øvelser, og det er det, vi har behov for, og det er også det danske erhvervsliv har behov for, hvis de skal løse nogle af vore store udfordringer med klima og sundhed.Vi kunne blandt andet også bare lade os inspirere tilgangen hos statens museum for kunst, som digitaliserer værker og stiller dem til rådighed for hele insulatet og lader andre bruges og udstille på deres egen platform.Det gør man med skarpt øje for formålet om at fremme kulturarven, så enhver kan bruge værkerne i alt for skoleopgaver til en ny digital platform.Udbredelse og anmeldelse er vigtigere, end at den enkelte bruger besøger statsmuseum for kunsts egen hjemmeside eller fysiske udstillinger.Den tilgang kan godt lide.Og det er klart, at udviklingen af kunstlinenskegenskaber bliver et væsentligt konkurrenceparameter de kommende årtier.Ergået er brug for, efter vores mening, en lidt mere liberal tilgang, så vi får de konkurrencedygtige virksomheder op at flyve, en mere liberal tilgang, reguleringen er af i, end der lægges op til i B toogfyrre.",Mona Juul_video_41_start_1-57-47
"Spørgsmålet, hvis jeg prøver at afgrænse det i forhold til, hvor er det, vi mener, man skal kunne indlede frakendelsessager, er statsborgerskab, så er det, når det kommer, at kriminalitet er særlig farlig karakter, serieforbrudelser, voldtægtsforbrudelser, men det er også korrekt fortolket, at ja, det er et svigt, ligemeget hvilken kriminalitet man egentlig begår, men det er ikke, fordi liberal alliance ønsker at indlede frakendelsessager, at kriminalitet er mindre grad.",Sandra Elisabeth Skalvig_video_41_start_3-57-08
