hviske,file
"Tak for det formand.Tak til SF for at fremsætte det her beslutningsforslag, og især dels hed tak til ordføreren, Frulisbet Beck Nielsen, der om nogen har kæmpet denne kamp om alt, hvad der handler om digitalisering og kunstig intelligens i snart en halv menneskealder, både inden for og uden for på Christiansborg.På et socialt medie her for nylig, der blev diskuteret kunstig intelligens på Christiansborg, og en bekendt af mig havde skrevet i et kommentarfelt, at det var dog dejligt med kunstig intelligens på Christiansborg, for så var der dog nogen intelligens på Christiansborg. Og spøj til side, jeg synes det er helt åbenlyst, at vi selvfølgelig har brug for at diskutere det her. Jeg bliver en lille smule træt af, når vi har de her diskussioner, at der altid bliver henvist til et eller andet EUspor.For når man tænker på, hvor vigtig den her dagsorden er, ja, hvad har vi lært af andre dagsordre, der er vigtige?Det er, hvis de er så vigtige, så det er en dum ide at overlade det til EU.Så det er i hvert fald noget, som vi har brug for at diskutere rigtig meget selv.Det kan også være, at vi har brug for at diskutere det i eu-regi, men det giver enormt god mening, at vi også diskuterer det her.Det giver også mening, at Danmark, som et af de mest digitaliserede lande i Europa, selvfølgelig har en stærk stemme på det her blandt andre lande, og at vi har ministerer, som er aktive over for andre lande med det arbejde, der foregår i Bruxelles.Langt hen ad vejen er jeg enormt positiv over for SFs forslag.Jeg ved ikke, om det rigtige er at lande en beretning på det, eller om det er at sende det til afstemning, det må ordføreren jo om, men vi er faktisk meget positive over for nogle af de her takter, der ligger i det, fordi opfindelsen af kunstig intelligens måske er en af de største opdagelser i menneskehedens nyere historie, noget af det, der vil ændre vores samfund allermest i de her år og i de kommende år i særdeleshed. Og der synes vige danske folkepartier, at det er meget vigtigt, at der er en stærk, lovbaseret regulering, at det ikke er firmaer, der er på den anden side af jordkloden, der får lov til at sætte dagsordenen for, hvad man kan og ikke kan med kunstig intelligens, men at det er noget, hvor vi har noget gennemsigtighed, men også hvor det er demokratiets spilleregler, der er afgørende for, hvordan den her teknologi vil udfolde sig. Det er det ene aspekt i det. Det andet aspekt er jo også, at den vestlige civilisation jo er en enorm konkurrence med andre civilisationer, der måske tager nogle helt andre hensyn end vi vil gøre. For eksempel det, der foregår i Kina i de her år, som også buldrer derudad, buldrer fremad, men som har nogle helt andre værdier, man lægger ned over den her nye teknologi.Der er nogle helt andre værdier, man lægger ned over den her nye teknologi. Så min konklusion er, at der er mange gode ting i det her forslag, og det vil vi meget gerne arbejde videre med, og store dele af det kan vi for så vidt også støtte. Tak for ordet. Der er ikke ønske om korte bemærkninger, tak til herre Peder Kvart.",Peter Kofod_video_41_start_2-12-10
"Tak for ordet.Med beslutningsforslaget i dag ønsker forslagsstillerne, at Danmark træder ud af statsborgerretskonventionen, som stammer fra nitten syvoghalvfems.Da konventionens bestemmelser ifølge forslagsstillerne ikke muliggør, at kriminelle mennesker, herunder voldtægt forbrugere og seriekriminelle, kan fratages dansk statsborgerskab som konsekvens af deres alvorlige kriminalitet.Jeg vil gerne starte med at understrege, at vi deler forslagets intention, for vi synes grundlæggende også, at det er et problem for Danmark, at man ikke kan fratage kriminelle udlændinge deres statsborgerskab for alvorlig kriminalitet.For kriminelle udlændinge har selvfølgelig ikke fortjent at få det danske statsborgerskab, når man begår alvorlig kriminalitet efterfølgende. Det har vi desværre set alt for mange eksempler af. Derfor anerkender danmarksdemokraterne også til fulde, at statsborgerretskonventionen er et problem for Danmark, for det er desværre endnu et eksempel på, at konventionerne er skrevet i en tid, som ikke repræsenterer den tid, vi lever i i dag.Med andre ord er den ikke længere tidssvarende, når konventionen beskytter kriminelle udlændinge, det skal vi selvfølgelig have gjort noget ved.Derfor mener vi også i danmarksdemokraterne, at vi skal tage et opgør med konventionerne.Vi har brug for at få afdækket, hvordan man kan udfordre og ændre konventionen, så vi kan presse rammerne for konventionen til det yderste, så det i højere grad kan blive nemmere at kunne fratage statsborgerskabet for kriminelle udlændinge.Men vi anerkender også, at det er vigtigt for et lille land som Danmark, at der sættes nogle fælles rammer, og etableres en fælles spilbane, man skal overhold denne kultur, skal man være i denne kultur, skal man være i denne kultur, skal man være i denne kultur, skal man være i denne kultur, skal man være i denne kultur, skal man være i denne kultur, skal man være i denne kultur, skal man være i denne kultur, skal man være i denne kultur, skal man være i denne kultur, skal man være i denne kultur, skal man være i denne kultur, skal man være i denne kultur, skal man være i denne kultur, skal man være i denne kultur, skal man være i denne kultur, skal man være i denne kultur, skal man være i denne kultur, skal man være i denne kultur, skal man være i denne kultur, skal man være i denne kultur, skal man være i denne kultur, skal man være i denne kultur, skal man være i denne kultur, skal man være i denne kultur, skal man være i denne kultur, skal man være i denne kultur, skal man være i denne kultur, skal man være i denne kultur, skal man være i denne kultur, skal man være i denne kultur, skal man være i denne kultur, skal man være i denne kultur, skal man være i denne kultur, skal man være i denne kultur, skal man være i denne kultur, skal man være i denne kultur, skal man være i denne kultur, skal man være i denne kultur, skal man være i denne kultur, skal man være i denne kultur,de om at udpege en ambassadør, der skal sikre, at Danmark engagerer sig i arbejdet med konventionerne, herunder hvordan de fortolkes og anvendes, så de i langt højere grad kan udfordres.Samtidig skal det klarlægges, hvilke andre lande, der har udtrykt kritik over for statsborgerets konvention, så vi i fællesskab med andre lande kan undersøge, hvordan vi gør konventionen mere tidssvane.Tror du, at det er en løsning, der skal være løsninger, så er det en løsning, der skal være løsninger.",Kristian Bøgsted_video_41_start_3-36-23
"Jamen, vi støtter også forslaget, det er positivt, at man med det her forslag indfører flere defensive foranstaltninger over er selskaber og enkeltpersoner, som unddrager sig skat, altså som operærer og tjener penge, for eksempel i Danmark, lever godt på det, men ved hjælp af skattelige unddragere og bidrag til det samfund, som er baggrund, kan man sige, eller på vis skuldre, at man skaber sin succes og sin formue.Skuldre, at man skaber sin succes og sin formue.Det er nogle relativt begrænsede skridt, måske nogle af dem lidt mere symbolsk karakter, og vil jo ikke løse det enorme problem, vi har med skattely, som jo koster vores samfund, og dermed jo alle skatteydere, rigtig, rigtig mange penge hvert eneste år. Det skyldes jo, at dels at man i Danmark har valgt at tilgangspunkte i eues skattelys, som jo er mangelfulde, der er jo notoriske skattelyslande, som ikke er omfattet af den her liste, og som det også har været nævnt før, så det føler også en udfordring af de skattelys, som er i-medlemsstater, som for eksempel Luxembourg og andre, ikke er omfattet, og ikke kan omfattes af denne liste.Det er et problem, fordi vi ved, at meget ofte så anvender man jo ikke skattely direkte, men bruger en mellemstation, som for eksempel Luxembourg, for at kanalisere sine penge ud i skattely, og dermed kan det blive svært at opdage, og dermed sanktionere de selskaber, der gør det her.Den danske regering har ikke været specielt offensiv i de debatter i EU i forhold til at få udvidet den her skattelyliste, og det er et problem.I forhold til at få udvidet den her skattelyliste, og det er et problem, og selv hvis man havde tabt de kampe, så kunne man jo have ladet en mere vidtgående skattelyliste selv, og det harfattelse, der bliver udtryk for herop fra, at, og har gennem tiden har gjort, der er partier og regslog, at det skulle stilles som betingelse, at hvis man skulle modtage hjælpepakker for staten, så var det oplagt, at man ikke samtidig kunne operere skattely.Det var der ikke vilje til dengang, og det var endda på trods af everkommissionen, som sætte opfordrede medlemslandene til at lave de krav i forbindelse med hjælpepakker.Så vi er meget langt fra i mål, men ethvert lille skridt i den rigtige retning er selvfølgelig positivt, og derfor støtter enhedslisten forslag.",Pelle Dragsted_video_41_start_2-43-48
"Hvis man tænker eksempel til enden, herre Mikkel Bjørn, så ville du jo fratage et statsborgerskab fra en person, som havde begået kriminalitet, som var blevet dømt ved danske dommerstole, som man skal. Det er vi ikke modstandere af i elenslisten. Jeg kan forstå, at danske folkepartier har lidt svært ved at læse vores politik, men det lever jeg så fint med. Så ville personen vedkommende være blevet dømt, så havde vedkommende fået frataget sit danske statsborgerskab, hvis det stod til dansk folkeparti, og så ville vedkommende jo sidde på et ruddrejsecenter et andet sted. Hvordan skulle det hjælpe nogen som helst, og hvordan skulle det i øvrigt sikre generelt, at der ikke ville være kriminalitet i Danmark? Det er bare for at sige, hvis det var så nemt, ville der jo ikke være nogen kriminalitet i Danmark.Det er bare for at sige, hvis det var så nemt, ville der jo ikke være nogen kriminalitet i Danmark.Dansk folkeparti har jo haft held med, desværre må jeg sige, at heroes straffene i det her land de sidste tyve år har da stoppet kriminaliteten i det her land, herre Mikkelbjørn, ja eller nej.",Rosa Lund_video_41_start_4-09-55
"Jeg tak.Der var nogle gode intentioner i ministerens tal, og jeg ville gerne hjælpe miljøministeren til at være rigtig miljøminister, og ikke sådan en københavnsk version af smadremanden, hvor et mest muligt genbrugt byggemateriale bliver til vejfyld, som er situationen nu. Altså, vi skal frem til, at der bliver udviklet på det her. Og når ministeren siger, at det er plus, så nu kommer vi frem til et andet autorisation på at lave det her nedbrydningsarbejde.Der er jo meget store forskel på, om man skal nedbryde en femetagers bygning inde i byen med naboer lige ved siden af, eller om man valgte, at man også kunne genbruge byggematerialer fra et parcelhus, hvor der er langt til naboen, og hvor man kan bruge noget mere simpelt materiale.Jeg synes egentlig, at det er nogle af de nemme løsning, men ministeren engang, kan, hvad skal man sige, komme med nye regler, hvorfor ikke fastlægge nu, at der skal laves regler for to hundrede halvtreds kvadratmeters bygninger.",Søren Egge Rasmussen_video_40_start_1-09-48
"Jeg har fået tildelt dansk statsborgerskab, så er man jo dansker, og det er derfor, jeg grundlæggende ikke forstår den forskel, som danske folkepartier lever.Altså, danske statsborgere er danske statsborgere, uanset hvordan man vender at dreje det, og så må jeg da så bare tilføre til danske folkepartier, at det er danske folkepartier, der har haft held med, at det er sålændingepolitiken de sidste tyve år, men det er der ikke.",Rosa Lund_video_41_start_4-14-09
"Jeg har også sat i gang, jeg er blevet kontaktet måske af nogle af de samme gode folk, som har kontaktet ordføreren i forhold til, at der er nogle udfordringer på det område her, og det mener jeg da bestemt, at vi skal kigge på, og man kan vel altid diskutere, hvad en sport er, altså, men så længe vi kvalificerer blandt andet dart og skak og andre ting som sport, så kan jeg heller ikke se på, hvor man ikke skulle kvalificere esport til at gælde under samme kategori.Så det er i gang, men jeg synes også, det er fair nok lige at give lidt tid til, at man kan undersøge, hvad er problemetikken, hvad er det for nogle procedurer, der er gået galt, siden at folk oplever det på den måde her, før vi sådan træffer konklusioner om, hvad der så skal gøres ved det.",Kaare Dybvad Bek_video_41_start_0-55-22
"Jeg mener, at vi alle sammen egentlig kan.Jeg tror, at vi stort set alle sammen har haft nogle relationer til, hvordan folk har haft det i forhold til sygehusevæsenet, i forhold til plejehjemssektoren.Hvis vi er heldige at blive gamle nok, så bliver vi selv omfattede af det, og vi har vel et eller andet sted alle sammen, en forældre, en moster, en fester, en onkel, eller sådan må det være.Så derfor synes jeg, at det gør spor, at man også siger, at jeg kender det godt.Det tror jeg er ret, ret vigtigt, at vi også har medlænninger i debat, fordi det er virkelig alvorligt, det her.ordfører",Pia Kjærsgaard_video_44_start_6-45-11
"Som ministeren insisterer på, er det, jeg også selv insisterer på, at det er jo, at politiet har mulighed for at passe deres arbejde og gøre det på den måde, som de også selv synes er den bedste måde at gøre det på, og det er jo blandt andet at bruge signalementer, og jeg ved ikke, hvor ofre har den der forståelse af, at man ikke gør det, jeg synes i flæng, men heldigvis ser, at politiet også bruger, hvordan folk ser ud, hvilken etnicitet de har os ved, når de laver signementer, fordi det netop skal bruges til at kunne opklare nogle af de meget alvorlige forbødelser. Tusind tak.",Bjørn Brandenborg_video_44_start_3-00-24
"Hvis der er et par korte bemærkninger, så skal jeg lige sige, det er fuldstændigt korrekt, at lyset var gået ud, og kan konstaterer, at der er lys igen. Vi prøver og fortsætter, ellers så vil jeg foreslå i første omgang, at vi prøver at køre, og så vil vi blive ude for lige på stående for et par korte bemærkninger, og svømmer lige foran en sæl, der siger tredive sekunder, hvis det er, at det virker, vi prøver, om vi kan fortsætte, og det er fejlanmeldt, men foreløbig bare anmeldeldelsen virket, så det må vi sige, det er jo godt.Vi fortsætter, og derhen kår bemærkning til fru Birgitte Winden.",Erling Bonnesen_video_40_start_2-31-17
"Jeg er udmærket bekendt med, at også SF laver en indsats, så det gør de fleste miljøministre og regeringspartier uanset favor for at prøve at håndtere nogle af de her problemer, fordi der er jo ikke nogen, derddet totalt op, men vi deler jo alle sammen ambitionen om, at vi jo, når man deltager i finanslovsforhandlinger uanset om man er regeringsparti eller oppositionsparti, at vi så får mest mulig hastighed på de her ting. Tak til venstres ordfører.",Erling Bonnesen_video_40_start_3-31-26
"Hvis man opfylder kravene til dansk statsborgerskab, så skal man have dansk statsborgerskab. Og det skal ikke være nogen hemmelighed, at vi i engelsklisten synes, at kravene er for stramme i dag.Jeg synes ikke, og vi synes ikke i engelsklisten, at man skal straffes ved ikke at kunne få dansk statsborgerskab for noget kriminalitet, man har begået for ti år siden. Det er heldigvis sådan i det her land, at man ikke er straffet for evigt. Det er sådan vores strafssystem fungerer, det er det strafssystem, vi tror på i det her land, fordi vi ikke tror på, at man skal være kriminel eller dømt for evigt. Det er blandt andet også derfor, at vi ikke går ind for livstidsstraf, som andre partier her i folketinget gør.",Rosa Lund_video_41_start_4-16-02
"Det tror jeg da helt klart, at det kan være en vej at gå, at vi sætter os sammen og siger, hvad kan vi opnå politisk enighed om, skal håndteres i forordningen, hvad kan vi begynde at gøre allerede nu, og hvilke ting synes vi er vigtige, som forordningen ikke kommer til at håndtere.Hvis der er nogen, der har ondt i sigte og vil bruge deepfakes og andre teknologier til at sprede misinformation og destabilisere vores samfund, så det er jo ligegyldigt, at vi har en forordning, fordi de er jo kriminelle og har ikke tænkt sig at overholde loven alligevel. Så det kommer jo ikke til at betyde nogenrdig information.Det er en kæmpe udfordring, som forordningen jo ikke kommer til at løse.Så jeg tror sagtens, vi kan finde fælles fodslag, det er jeg i hvert fald interesseret i.",Lisbeth Bech-Nielsen_video_41_start_2-30-46
"Tusind tak.Jeg kan godt huske, da man lavede den her stramning omkring bandemedlemmer, hvor det skulle være til fare for Danmarks vitale interesser eller statens vitale interesser, og der skal det jo både være terrorister, bandemedlemmer og alle mulige andet samtid, før man kan komme ind under, at jeg ved engang, om der er en eneste, der er blevet frakant statsborgerskabet på den baggrund, netop fordi man holder sig stædigt fast i den her fuldstændigt tåbelige konvention, som absolut ingen gavn giver til Danmark. Tværtimod, der var masser af andre lande, som vi under normale omstændigheder sammenligner os med. Altså, der er Spalien, Italien, Irland, Storbritannien, Frankrig, Belgien, og jeg kunne blive ved og blive ved og blive ved, som ikke har ratificeret denne her, netop fordi det er tudet tosset, og overlægge, hvad skal man sige, muligheden for blandt andet at frakende statsborgerskabet for dybt kriminelle mennesker til nogle helt andre end dem, der ligesom er valgt i Danmark. Så jeg kunne egentlig bare godt tænke mig at høre ministeren, det ministeren reelt set står og siger her fra folketingets talerstol, og jeg vil synes ikke glad for ministeren anerkender, at det er det, der er realiteterne, det er vi jo nogle, der har vist længe,let i udenlandsk politik, fordi vi netop er ligeglade med konventioner, som dem ministeren tilsyneladende er så glad for.",Mette Thiesen_video_41_start_3-00-06
"Jeg er meget påpaselig med at mistænke enten anklagemyndighedens påstand om varetægtsfængsling og tilsvarende dommernes afgørelse af det, som er et hensyn til kapaciteten i kriminalforsorgen.At der så er kapacitetsudfordringer i kriminalforsorgen, er jeg fuldstændig enig med at have pæter kuffet. Jeg tror, der kan være mindst lige så mange eksempler på, hvor man enten burde have varetægtsfængslet eller i hvert fald burde have gjort noget andet. Jeg synes, den skrækkelig, skrækkelig sag med politibetjenten, Magnus Buhl, der blev slået hjælp på lange bro, hvor det er, at gerningsmanden, eller i hvert fald den mistænkte, efterfølgende, ikke bliver varetægtsfængslet og derefter udrejser landet,Spørgeren for emn kort bemærkelseskolen skal trykke sig ind.",Peter Hummelgaard_video_44_start_5-05-10
"Jeg synes, vi skal huske, at når vi frisætter, så handler det denne om, at man har frihed til at gøre noget. Og så skal man jo diskutere herinde, hvor megen kontrol mener vi så, der skal være med den her frisættelse, og specielt når det kommer til natur- og miljøområdet for at tage den, så velleve på, vi har garanterkommuner.Det kan selvfølgelig godt være positivt, men jeg hører også ministeren sige, at man jo ikke lukker nogen døre i forhold til, er der andre emner, man kan tage op og se på, der er jo ikke noget, der er statisk i politik, og det kan da godt være, at der vil være nogle områder, hvor det kan vise sig, at her kan vi, ligesom vi har gjort på grønne bymeter, at her kan vi lave nogle aftaler, som vi kan sprede ud til flere kommuner.",Birgitte Vind_video_40_start_1-50-09
"Jeg vil gerne have det i folketinget, der stører udviklingen i samfundet, men vi vil løse denne løsning.",Søren Egge Rasmussen_video_40_start_0-24-56
"Beslutningsforslaget, vi behandler her, omhandler gennemførelsen af lovgivningen, der pålægger politik og domstole at udarbejde præcise signalementer, hvis muligt, for eksempel i døgnrapporter eller udtalelser i medierne.Sådanne oplysninger skal også journaliseres og gælde for anholdte, mistænkte, sigtede, tiltalte og i sidste ende dømte personer.Lad os fremsværre takke dansk folkeparti for at sætte fokus på emnet.Beslutningsforslagets indledende tekst beskriver vigtigheden af gennemsigtighed for at styrke borgernes tillid til retssystemet.Tillid til vores institutioner er afgørende for et velfungerende retssystem, og imens et velstående land, det er jeg og liberaliansne meget enige i, og vi skal værne om at styrke tilliden til vores institutioner.I dag har politiet hvide rammer for at udarbejde præcise og detalerede signalementer, hvis de finder det relevant for det politimæssige arbejde.Og i liberal alliance laver vi altså tillid til, at dansk politi gør dette i dag.Dette bakkes også op af blandt andet rejseholdets tidligere chef, Bent Isager Nielsen, som har kommenteret emnet, han udtalte blandt andet i tyve tyve, at han oplevede, at den danske tilgang prioriterede at fremhæve så mange oplysninger som muligt, og at udseende og signalementer anvendes politifagligt uden at blive tilbageholdt af misforstået politisk korrekthed.Liberale anelser mener også grundlæggende, at der er bred tillid til, blandt andet politierne seneste troværdighedsmåling, placerer politibetjente i top fem med tre, to og firs ud af fem mulige point, hvilket har været stabilt siden to tusind og ni.Dette betyder dog ikke, at vi blænder overrekthed overstiger den objektive sandhed, hvilket skaber et misvisende billede i medierne og en afgivelse i virkelighedsopfattelsen.Dette svækker tilliden til vigtige institutioner som politi og domstole.Heldigvis er Danmark ikke i samme situation som Sverige på dette område.Til gengæld bruger vores politifolk i dag omkring en tredjedel af deres tid på ledelse og administrative opgaver, hvilket vi ikke ser behov for at øge yderligere gennem lovgivning med obligatoriske præcis og signalementer og journaliseringer.Forslaget her er altså unødvendig detaljestyring af offentlige myndigheder, det øger bureaukratiet, og det virker ikke i ældreplejen, så hvorfor skulle det virke hos politiet?Og det virker ikke i ældreplejen, så hvorfor skulle det virke hos politiet?På baggrunden af dette finder vi ikke grundlag for at støtte beslutningsforslaget, som det foreligger nu.Vi opfordrer derimod politiet til fortsat at udarbejde præcis af sine elementer, når de finder det relevant, uden at lade sig begrænse af misforstået politisk korrekthed.Den kom bemærkning til ham, Mikkel Bjørn, dansk folkeparti.",Steffen Larsen_video_44_start_3-24-01
"I Danmark, der er varetægtsfængslermand, hvis den sigtede har gjort noget strafbart, som har en strafferamme på et år og seks måneders fængsel. Derudover så skal dommeren vurdere, at der er en risiko for, at den sigtede vil begå ny lovholdsredelse, eller at den sigtede vil prøve at forhindre opklaring af sagen, for eksempel ved at slette sine spor, påvirke vidner eller medegerningsmænd. Det synes jeg også at sætte ret fine argumenter for varetægtsfængslet.Det synes jeg, som sætter ret fine argumenter for at varetægtsfængsle.I Danmarksdemokraterne, der ønsker vi ikke, at gerningsmænd, som kunne være sigtet for frygtelige forbrydelser, som vi så med ubådssagen, skal kunne gå frit rundt og kommunikere med omverdenen og potentielt obstruere en efterforskning.Derudover mener vi i Danmarksdemokraterne heller ikke, at vi af hensyn til for eksempel ofre for personfarlig kriminalitet kan tage så store hensyn til gerningsmanden, som det i så omfattende grad foreslås med forslaget?Det er vores klare opvisninger, at for at bevare borgernes retsfølelse og retssikkerhed er det nødvendigt, at varetægtsarstander forbliver bag lås og slå.I Danmarksdemokraterne står vi altid på offrets side.Forslagstillere henviser til spørgsmålet tre to og firs, af sjette marts to tyve tre og tyve, i forhold til hyppigere og længere varetægtsfængslinger, men tabellen siger noget andet.Her kan man se, at antallet af varetægtsfængsler er faldet støt siden toogfjorten til toogtyve.Til gengæld er det korrekt, at de varetægtsfængsled at blive forløst, vil det blive forløst.",Betina Kastbjerg_video_44_start_5-34-01
"Det er godt at få opklaret, at det alene er den sidste del af beslutningsforslaget, som de liberale annonce ikke er enige i. Den har faktisk inspireret den amerikanske tilgang, hvor man pålægger virksomhederne en form for selvjustits, altså når man opdager diskrimination og bias i sine produkter, som man ellers får pligt til at rette, en tilgang, som virksomhederne i USA selv havde ønsket sig, fordi det selvfølgelig er meget mindre indgribende end for eksempel vores AI-forordning, der har en anden, hvad skal man sige, regulatorisk tilgang.",Lisbeth Bech-Nielsen_video_41_start_1-56-28
