name,text,duration,start_clock,end_sec,start_sec,start_min,end_min,video_id
Anne Paulin,"Tak for det, formand. Lovforslag L 90, som vi behandler nu, er af meget teknisk karakter, og det er fremsat på baggrund af en udtalelse fra Europa-Kommissionen vedrørende gennemførelsen af miljøansvarsdirektivet. Udtalelsen skyldes, at Kommissionen vurderer, at det i den danske lovgivning ikke er klart nok defineret, hvilke persongrupper der har ret til at anmode om foranstaltninger vedrørende miljøskade eller klage over myndighedernes afgørelser. Med lovforslaget her præciseres den danske lovgivning til at have den samme ordlyd som direktivet, og det støtter Socialdemokratiet.",35.0,13:04:03,308,273,0:04:33,0:05:08,40
Søren Gade,"Tak for det. Der er ingen korte bemærkninger, så vi siger tak til fru Anne Paulin fra Socialdemokratiet. Jeg byder nu velkommen til hr. Erling Bonnesen fra Venstre.",14.0,13:04:38,322,308,0:05:08,0:05:22,40
Erling Bonnesen,"Mange tak for det. Venstre støtter også lovforslaget. Det er netop blevet så glimrende gennemgået af den foregående ordfører, så der er ingen grund til at gentage det. Venstre støtter lovforslaget.",9.0,13:04:52,331,322,0:05:22,0:05:31,40
Søren Gade,"Tak for det. Der er ingen korte bemærkninger, så vi siger tak til hr. Erling Bonnesen fra Venstre. Jeg byder nu velkommen til fru Marianne Bigum fra Socialistisk Folkeparti.",23.0,13:05:01,354,331,0:05:31,0:05:54,40
Marianne Bigum,"Vi har fået en udtalelse fra EU, som egentlig har en konklusion om, at det her direktiv, vi har, ikke er gennemført tilstrækkelig klart og præcist i dansk ret, hvorfor den danske lovgivning ikke giver borgerne tilstrækkelig retssikkerhed. Ud over at sidde med en masser af miljøsagerne har jeg også fornøjelsen af at være vores EU-ordfører, og jeg husker den første åbningsskrivelse fra Kommissionen, en mail, der lød på traktatbrud, og jeg panikkede: Det kan vi ikke have, hvad gør vi her? Så blev jeg af mere erfarne kræfter belært om, at dem får vi mange af. Så jeg er egentlig rigtig glad for, at vi her er ved at rette op på noget af det, som vi har fået en udtalelse fra EU om, nemlig at vi ikke gennemfører det godt nok. For det er jo faktisk ret alvorligt, når vi får at vide, at vi ikke giver borgerne tilstrækkelig retssikkerhed, og det skal vi selvfølgelig rette op på. Derfor undrer det mig en lille smule, når der så samtidig står i lovforslaget, at lovforslaget alene indebærer en præcisering af gældende ret og medfører ikke ændringer i retstilstanden. Det kan godt være, at det bare er ord, og at vi, hvis bare vi får ændret dem, får en bedre retstilstand, men jeg har simpelt hen ikke været helt sikker på, om jeg kunne læse det. Umiddelbart tænker jeg, at vi, når vi får en udtalelse fra EU, som siger, at vi simpelt hen ikke gør det her tilstrækkeligt, og så går i salen for at ændre dansk lov med den præcisering, at det faktisk ikke ændrer på retstilstanden, egentlig så er lige vidt. Derfor er jeg nysgerrig på, om vi gør det her godt nok, og det kommer vi til at stille nogle spørgsmål til i behandlingen af det her lovforslag, sådan at vi, hvis det er sådan, at der er tale om en praksis, som simpelt hen ikke er god nok, er helt sikre på, at vi får gjort op med den her mangelfulde retstilstand, som der åbenbart er. Men vi ser i SF frem til den videre behandling af sagen, og vi glæder os i hvert fald til at tage fat i et af de udeståender, vi har med EU, i forhold til opdatering af vores lovgivning.",136.0,13:05:24,490,354,0:05:54,0:08:10,40
Søren Gade,"Tak for det. Der er ingen korte bemærkninger, så vi siger tak til fru Marianne Bigum fra Socialistisk Folkeparti. Jeg byder nu velkommen til fru Charlotte Bagge Hansen fra Moderaterne",8.0,13:07:40,498,490,0:08:10,0:08:18,40
Charlotte Bagge Hansen,"Tak for det, formand, og tak for en god og grundig gennemgang til min socialdemokratiske kollega. Jeg vil sige, at lovforslaget her gør det lettere for alle borgere at forstå og udøve deres rettigheder i forhold til miljøskader, så derfor støtter vi naturligvis forslaget.",26.0,13:07:48,524,498,0:08:18,0:08:44,40
Søren Gade,Tak for det. Der er ingen korte bemærkninger. Vi siger tak til fru Charlotte Bagge Hansen fra Moderaterne. Jeg byder nu velkommen til hr. Hans Kristian Skibby fra Danmarksdemokraterne.,2.0,13:08:14,526,524,0:08:44,0:08:46,40
Hans Kristian Skibby,"Tak. Jeg vil gerne lige allerførst sige, at hvis det skulle være en god og grundig gennemgang af Socialdemokraternes ordfører, er der andre gange, hvor jeg i hvert fald har oplevet den endnu mere grundig, vil jeg gerne sige. Men jeg anerkender selvfølgelig også, at det ikke er det mest vidtgående lovforslag, som vi behandler her i dag. Det er et mindre lovforslag, som sikrer en bedre præcisering af borgernes retsgrundlag i forhold til miljøskader. Det er jo sådan, hvis man kigger på Europa-Kommissionen, at så har den jo konkluderet, at dele af det her miljøansvarsdirektiv ikke var tilstrækkelig gennemført i dansk lovgivning, og at det ikke var klart præciseret, hvilke regler og vilkår der var i forhold til den enkelte borger. Det er det, der forsøges gjort med det her lovforslag, og det støtter Danmarksdemokraterne.",53.0,13:08:16,579,526,0:08:46,0:09:39,40
Søren Gade,"Tak for det. Der er ingen korte bemærkninger. Vi siger tak til hr. Hans Kristian Skibby fra Danmarksdemokraterne, og jeg byder nu velkommen til hr. Alexander Ryle fra Liberal Alliance.",13.0,13:09:09,592,579,0:09:39,0:09:52,40
Alexander Ryle,"Som der er blevet redegjort for allerede meget fint, er formålet jo at rette op på implementeringen af miljøansvarsdirektivet på baggrund af en begrundet udtalelse fra Europa-Kommissionen. Lovforslaget indebærer alene en præcisering af gældende ret og vil ikke medføre, at flere eller færre vil have mulighed for at anmode den kompetente myndighed om at træffe foranstaltninger m.v. eller have mulighed for at klage. Liberal Alliance støtter forslaget.",24.0,13:09:22,616,592,0:09:52,0:10:16,40
Søren Gade,Tak for det. Der er ingen korte bemærkninger. Vi siger tak til hr. Alexander Ryle fra Liberal Alliance. Jeg byder nu velkommen til hr. Søren Egge Rasmussen fra Enhedslisten.,11.0,13:09:46,627,616,0:10:16,0:10:27,40
Søren Egge Rasmussen,Enhedslisten støtter lovforslaget.,3.0,13:09:57,630,627,0:10:27,0:10:30,40
Søren Gade,Tak for det. Der er ingen korte bemærkninger. Tak til hr. Søren Egge Rasmussen fra Enhedslisten. Jeg byder nu velkommen til fru Katrine Robsøe fra Radikale Venstre.,15.0,13:10:00,645,630,0:10:30,0:10:45,40
Katrine Robsøe,"Tak for det. Jeg skal ikke trække spændingen alt for meget. Radikale Venstre støtter også lovforslaget. Hvis jeg skal knytte bare en enkelt bemærkning til det, også til noget af det, der er blevet sagt her i forhold til lovforslaget, så læser jeg i hvert fald lovforslaget på den måde, at man jo indtil videre egentlig har praktiseret, i praksis i lovgivningen, efter de regler og altså direktivet, men det har bare ikke på skrift stået tydeligt nok i loven, og derfor synes jeg jo også, der er en meget naturlig udvikling i, at lovteksten rent faktisk stemmer overens med den praksis, vi kører efter. Så derfor støtter Radikale Venstre naturligvis forslaget.",36.0,13:10:15,681,645,0:10:45,0:11:21,40
Søren Gade,Tak for det. Der er ingen korte bemærkninger. Vi siger tak til fru Katrine Robsøe fra Radikale Venstre. Jeg byder nu velkommen til hr. Morten Messerschmidt fra Dansk Folkeparti.,8.0,13:10:51,689,681,0:11:21,0:11:29,40
Morten Messerschmidt,"Tak, formand. Det vil nok ikke komme som nogen overraskelse for hverken dette Ting eller folk, der lytter med, at vi i Dansk Folkeparti indtager et ganske kritisk standpunkt i forhold til EU. Det er jo dog, skal jeg så sige, ikke alt, der kommer fra EU, som nødvendigvis er fuldstændig idiotisk – det er bare det meste. På miljøområdet giver det dog på mange måder mening at lave fælles regler, hvis det i hvert fald løfter landene. Og det er klart, at indgår man i et forpligtende fællesskab, må man også sørge for, at reglerne fortolkes og forstås ens. Ellers skaber det en uensartethed, som både går ud over miljøet, men jo sådan set også går ud over de virksomheder og europæere, som skal agere inden for reglerne. Derfor ser vi selvfølgelig ikke noget problem i at kunne bakke op om den her præcisering, selv om vi måske i udvalgsarbejdet nok vil efterlyse en større forståelse for, hvordan det her kan ske. Er det enten noget ved det danske system, som har fordret en situation, hvor vi har fået den her uoverensstemmelse eller forskel mellem intentionen i EU-retten og så den danske ret? Eller er det måske noget ved EU-retten, der gør, at det af og til kan være vanskeligt at gennemskue, hvad det egentlig er, der er den egentlige ret? Meget ofte, når man læser EU-lovgivning, vil man jo se, at det er formuleret i brede vendinger, givetvis fordi det er kompromiser, der skal skræve over mange forskellige lande, mange forskellige interesser og jo også mange forskellige EU-institutioner. Og det gør altså, at det nogle gange kan være svært egentlig fuldstændig at dechifrere, hvad det er, der er hensigten med et lovforslag. Og det skaber en stor svaghed i retten som genstand for hele vores retssamfund, fordi det gør, at man hele tiden bliver afhængig af fortolkende institutioner, primært domstolene, og jo altså ofte EU-Domstolen. Vi har altid i Danmark tilstræbt, at loven skal være klar. Det er faktisk et af grundprincipperne helt tilbage fra Jyske Lovs præambel, at loven skal være tilgængelig, letforståelig, anvendelig og efter landets sædvane og skikke. Det er nærmest det modsatte af, hvad man ofte finder i EU-retten, hvor tingene kan være meget svært tilgængelige. Så vi vil egentlig gerne i udvalgsarbejdet have boret ud, hvad det er, der er problemets oprindelse. Skulle det, mod forventning, være et problem i statsadministrationen, eller er det et mere systemisk problem med EU-lovgivningen som retskilde? Jeg tror det, og så er jeg sikker på, hvis det er tilfældet, at både vi og regeringen selvfølgelig har en fælles interesse i at få illustreret, at det er et problem. Og så er vi jo tilbage ved det, jeg sagde i min indledning: Det er ikke alt, der kommer fra Bruxelles, der er skidt, men det er det meste. Tak for ordet.",175.0,13:10:59,864,689,0:11:29,0:14:24,40
Søren Gade,Tak for det. Der er ingen korte bemærkninger. Vi siger tak til hr. Morten Messerschmidt fra Dansk Folkeparti. Jeg giver nu ordet til fru Mette Abildgaard fra Det Konservative Folkeparti.,9.0,13:13:54,873,864,0:14:24,0:14:33,40
Mette Abildgaard,"Tusind tak for det. Jeg skal beklage over for mine kollegaer, at jeg ikke var til stede i salen, da det blev min tur. Jeg tror, jeg havde vurderet, at alles talelyst ville være lige så stor, som hr. Morten Messerschmidts lige var, og at alle ville være lige så engagerede i den her sag. Men det gik lidt hurtigere, end jeg lige havde luret. Jeg kan nu gøre det relativt kort på Det Konservative Folkepartis vegne og sige, at vi bakker op om det her lovforslag, som jo i høj grad er en nødvendighed for at få lavet den her præcisering af miljøansvarsloven og det pålæg, der kommer fra EU. Jeg synes, det er svært at vurdere med mine øjne, om man gør tilstrækkeligt for at nå i mål. Men det er nok en af de sager, hvor jeg må være helt ærlig og sige, at man må have tillid til, at vi har dygtige embedsmænd, der har lavet den nødvendige og korrekte vurdering af, at de justeringer nu er det, der skal til. Så jeg vil have den grundlæggende tillid. Tak.",50.0,13:14:03,923,873,0:14:33,0:15:23,40
Søren Gade,Tak for det. Der er ingen korte bemærkninger. Vi siger tak til fru Mette Abildgaard fra Det Konservative Folkeparti. Jeg byder nu velkommen til hr. Kim Edberg Andersen fra Nye Borgerlige.,12.0,13:14:53,935,923,0:15:23,0:15:35,40
Kim Edberg Andersen,"Det er jo ikke det største lovforslag, vi har haft, bliver jeg nødt til at sige. Jeg kan godt konkludere på Morten Messerschmidts tale og sige, at hvis vi nu bare lavede loven selv, var vi fri for at stå her i dag. Så skal vi ikke bare konkludere, at det kan vi godt klare selv? Så vil jeg godt rose mine folketingskolleger og sige, at juleferien har gjort, at vi har hurtig ekspedition i Folketingssalen. Nye Borgerlige kommer til at støtte lovforslaget, selvfølgelig gør vi det. Vi ser også frem til det, hvis det bliver gravet op, at dansk lovgivning nu engang er bedre end europæisk. Men det er jo et sted, vi som parti er ret trygge i at stå: at det nok er EU-lovgivningen, der for det meste er noget rod, og det danske Folketing, der nogenlunde altid har styr på det. Det ser vi frem til at ministeren begynder at implementere noget mere. Vi støtter forslaget og ser også frem til en lige så hurtig behandling af alle de andre lovforslag, vi får igennem året.",51.0,13:15:05,986,935,0:15:35,0:16:26,40
Søren Gade,"Tak for det. Der er ingen korte bemærkninger. Vi siger tak til hr. Kim Edberg Andersen fra Nye Borgerlige. Det afslutter ordførerrækken, og derfor giver jeg nu ordet til miljøministeren.",26.0,13:15:56,1012,986,0:16:26,0:16:52,40
Magnus Heunicke,"Tak for det, formand. Nu er det jo ikke en værdi i sig selv, at lovbehandlingen her i Folketingssalen går lynhurtigt. Det er fint, når den gør det, hvis det er temmelig overskueligt og der er stor enighed. Det er også fint, når der er grundige og lange debatter. Så begge dele synes jeg vi skal have plads til, og det har vi jo også ifølge vores forretningsorden. Her er sagen jo den – og det er det, som flere ordførere også har været inde på – at Danmark har modtaget en begrundet udtalelse fra EU-Kommissionen om vores implementering af miljøansvarsdirektivet, og det er Kommissionens vurdering, at en af bestemmelserne i direktivet ikke er gennemført tilstrækkelig klart og præcist i dansk ret, hvorfor den danske lovgivning ikke giver borgerne tilstrækkelig retssikkerhed. Regeringen er enig med Kommissionen, og det er derfor, regeringen har besluttet at præcisere implementeringen af direktivet, og det er det, der sker med behandlingen af lovforslaget i dag. Miljøansvarsdirektivet er i dag implementeret i vores danske miljøskadelov, miljøbeskyttelsesloven, og det gælder også en række andre love. Formålet er jo at forebygge og afhjælpe større miljøskader på jord, vand og beskyttede arter og naturtyper; det er det, vi kender som miljøskader. Ifølge miljøansvarsdirektivet har tre persongrupper rettighed til at anmode de relevante myndigheder om at træffe foranstaltninger vedrørende miljøskader og til at klage over myndighedernes afgørelse om foranstaltninger. Den ene af disse persongrupper er personer, som berøres eller kan forventes at blive berørt af en sådan miljøskade. Med lovforslaget foreslås det så, at direktivets ordlyd gengives ordret i netop miljøskadeloven og i de knyttede sektorlove. I dag er persongruppen implementeret i dansk ret ved begrebet om enhver med væsentlig individuel interesse i sagen. Det er et begreb, vi ellers kender generelt i Danmark; det anvendes som generelt begreb i vores miljø- og naturlovgivning. Men vurderingen fra Kommissionen er altså, at det ikke er tilstrækkelig klart for en almindelig borger, at det juridiske begreb om individuel væsentlig interesse i sagen eller i forhold til sagens udfald dækker den situation, der sigtes til med udtrykket »kan forventes at blive berørt af en miljøskade«. Regeringen er som sagt enig i dette synspunkt. Derfor fremsættes det her lovforslag, som har til formål at rette op på præcis det her, så det sikres, at borgernes rettigheder fremgår klart og præcist i dansk ret. Det er så det eneste, det her lovforslag indebærer, altså en præcisering af gældende ret. Ændringen af ordlyden i lovene vil ikke medføre, at flere eller færre vil have mulighed for at klage og anmode om foranstaltninger. Derfor ser jeg frem til den videre behandling af det her lovforslag.",184.0,13:16:22,1196,1012,0:16:52,0:19:56,40
Søren Gade,"Tak for det. Der er ikke nogen, der har bedt om korte bemærkninger. Så vi siger tak til miljøministeren. Der er ikke flere, som har bedt om ordet. Derfor er forhandlingen sluttet. Det er vedtaget.",25.0,13:19:26,1221,1196,0:19:56,0:20:21,40
Søren Gade,"Forhandlingen er åbnet, og den første ordfører, jeg giver ordet til, er fru Anne Paulin, Socialdemokratiet. Værsgo.",7.0,13:19:51,1228,1221,0:20:21,0:20:28,40
Anne Paulin,"Tak for det. Det lovforslag, vi skal behandle nu, handler om selektiv nedrivning og om at give ministeren mulighed for at fastsætte regler om selektiv nedrivning. Selektiv nedrivning lyder måske lidt kedeligt, men det er jo i virkeligheden utrolig interessant, fordi det handler om, hvordan vi sikrer en større ansvarlighed i håndteringen af affald fra byggeriet, og hvordan vi sikrer, at vi får genanvendt de materialer, der er i byggeriet, bedre. Det er jo altid bedst, hvis man kan bevare et byggeri og lade det stå, og at man ikke behøver at rive noget ned, når vi snakker om CO2og ressourceaftryk, men det næstbedste er trods alt at sikre, at når vi river noget ned, skal vi også kunne genanvende materialerne, og det her lovforslag er med til at sikre, at der kommer til at være krav om, at der skal være standardiserede nedrivningsplaner, når man nedriver bygninger, som er over 250 m² store, og at nedrivningsselskaberne skal være en del af en autorisationsordning. Så alt i alt er det her et lovforslag, som også er efterspurgt ude i erhvervet, og som kommer til at medføre, at vi får mindre byggeaffald, som udgør en meget stor del af de samlede danske affaldsmængder. Det er et lovforslag, som er med til at sikre, at vi kommer til at skulle kræve færre jomfruelige råstoffer, og at vi dermed også kan spare, når det kommer til råstofsudvindingsområdet. Det er med til at understøtte et marked for cirkulær økonomi, at vi kan få en skala i forhold til mængden af de her genanvendte byggematerialer. Det er jo allerede godt i gang derude, men de her krav kommer altså til at medføre, at vi kan få nogle større mængder, som gør det lettere at afsætte det, og at det dermed også kommer til at blive mere naturligt i fremtiden, når man bygger nyt, at man så kigger imod de her tidligere anvendte materialer. Så alt i alt er det et rigtig godt lovforslag, som er med til at understøtte en højere grad af cirkulær økonomi og en grøn omstilling af byggeriet i Danmark.",148.0,13:19:58,1376,1228,0:20:28,0:22:56,40
Søren Gade,Tak for det. Der er en enkelt kort bemærkning. Hr. Søren Egge Rasmussen fra Enhedslisten. Værsgo.,2.0,13:22:26,1378,1376,0:22:56,0:22:58,40
Søren Egge Rasmussen,"Tak. Der er mange gode høringssvar til det her lovforslag, og der er jo flere af dem, som spørger: Hvorfor sætte den her grænse på 250 m²? For på den måde tager man jo alle parcelhusene og alle villaerne ud af – hvad skal man sige – genbrugscirklen, og det synes jeg er rigtig ærgerligt. Jeg tror sådan set, at hvis man udelukkende har de store bygninger med, er der nogle specielle firmaer, der kan være dygtige til det, men hvis man åbnede op for, at det også var parcelhusene og villaerne, der var krav til genbrug af, så kunne man have nogle firmaer, som var dygtige til at håndtere nedrivning af nogle mindre bygninger. Jeg tror sådan set, at det erhvervsmæssigt ville være et plus, at man gav plads til det, ved at vi politisk stillede nogle krav, og der er jeg ikke tilfreds med, at der bare står, at ministeren får en bemyndigelse til, at han kan gøre det, hvis han får lyst til det. Jeg synes egentlig, det er bedre, at det er Folketinget, der styrer. Derfor vil jeg godt høre ordføreren, om ikke vi kunne prøve at kigge på, om den her grænse på 250 m² for bygninger er den rigtige, eller om vi skulle sætte den længere ned.",64.0,13:22:28,1442,1378,0:22:58,0:24:02,40
Søren Gade,Ordføreren.,1.0,13:23:32,1443,1442,0:24:02,0:24:03,40
Anne Paulin,"Det er jo til at være rigtig mange bygninger, bygninger til erhverv, landbrug og større beboelse, der kommer til at være omfattet af bestemmelsen om de her 250 m², men så er det jo også rigtigt nok, at der i lovgivningen er den her hjemmel til, at man også kan gå ind og lave regler for mindre bygninger i fremtiden. Jeg tror egentlig, det er en fornuftig måde at gribe det an på, at vi starter et sted, og at vi får nogle erfaringer med det, men jeg tror da også, at man i fremtiden sagtens kunne forestille sig, at man kunne udvide det her til at omfatte flere bygninger. For vi skal spare på vores ressourcer så mange steder som muligt. Men jeg synes også, det er fornuftigt, at lovforslaget er indrettet, som det er, og at ministeren får den her bemyndigelse til at kunne udvikle videre på det.",51.0,13:23:33,1494,1443,0:24:03,0:24:54,40
Søren Gade,Hr. Søren Egge Rasmussen.,2.0,13:24:24,1496,1494,0:24:54,0:24:56,40
Søren Egge Rasmussen,"Jeg vil altså hellere have, at det er Folketinget, der styrer udviklingen i samfundet, end det er ministeren. Det er min grundholdning. Det gælder især, når man har et kendt problem, og her har vi sådan set nogle høringssvar, som gør opmærksom på, at man kunne sætte den her grænse lavere, så man kunne øge genbruget. Med nogle krav til byggeriet om livscyklusanalyseberegninger og krav om at nedsætte CO2-udslippet for nybyggeri, hvor genbrugsmaterialer sættes til nul CO2-mæssigt, står vi over for, at der bliver et marked for genbrugsmaterialer. Hvorfor ikke få flest mulige genbrugsmaterialer ind i byggeriet? Det ville der sådan set være en CO2-effekt ved. Det, jeg appellerer til, er, at man genovervejer den her 250 m²-grænse.",38.0,13:24:26,1534,1496,0:24:56,0:25:34,40
Søren Gade,Ordføreren.,2.0,13:25:04,1536,1534,0:25:34,0:25:36,40
Anne Paulin,"Jeg forstår bestemt også ordførerens intention. Jeg tror egentlig bare, jeg kommer til at gentage mig selv, når jeg siger, at jeg egentlig tror, det er fornuftigt nok, at vi starter her, hvor vi gør, men at vi jo så også kan følge med i, hvordan det her kommer til at virke i praksis. Og selvfølgelig skal vi have øje for, at vi skal blive bedre og bedre og få formindskelsen af det her aftryk og genanvendelsen så meget i spil som overhovedet muligt.",28.0,13:25:06,1564,1536,0:25:36,0:26:04,40
Søren Gade,"Der er ikke flere korte bemærkninger, så vi siger tak til fru Anne Paulin fra Socialdemokratiet. Jeg byder nu velkommen til hr. Erling Bonnesen fra Venstre.",10.0,13:25:34,1574,1564,0:26:04,0:26:14,40
Erling Bonnesen,"Mange tak for det. Når det er blevet nødvendigt at nedrive større bygninger, er det helt logisk – sådan er det jo også allerede i praksis i mange situationer – at så skal man selvfølgelig genanvende de materialer, der bliver nedbrudt. Forslaget er også allerede på glimrende vis blevet gennemgået af den foregående ordfører, så det skal jeg ikke uddybende nærmere ud over at sige, at Venstre selvfølgelig også støtter det her lovforslag.",25.0,13:25:44,1599,1574,0:26:14,0:26:39,40
Søren Gade,"Der er ingen korte bemærkninger, så vi siger tak til hr. Erling Bonnesen fra Venstre. Og jeg byder nu velkommen til fru Marianne Bigum fra Socialistisk Folkeparti.",10.0,13:26:09,1609,1599,0:26:39,0:26:49,40
