name,text,duration,start_clock,end_sec,start_sec,start_min,end_min,video_id
Magnus Heunicke,"Tak for det. Spørgsmålet, vi drøfter her, er jo sådan set: Hvordan kan vi bruge vores arealer på en måde, hvor vi passer bedst muligt på miljøet og på mennesker og dyr – generelt på os selv og på vores miljø? Man må jo sådan helt overordnet sige, at Danmark har alt for meget jordforurening, og det kan vi faktisk se; jeg er ikke bekendt med, at der er nogen byer, som ikke slås med jordforurening. Det er gammel forurening, og det kan også være en ny forurening, der kommer. Vi er her i hovedstaden, i København, og størstedelen af jorden i København er forurenet. Nogle steder er den lettere forurenet, andre steder er det jo alvorlig forurening. Det kan være fra gamle industrier, og det kan også være forurening fra luften, der sætter sig i jorden, og sådan er det desværre. Vi har alt for meget forurenet jord i Danmark, og derfor er det jo helt relevant at se på: Hvordan er vores lovgivning i forhold til at behandle den forurenede jord? Hvordan kan vi sikre, at den byudvikling, der sker, det byggeri, der sker, ikke er steder og ikke er typer, som går ud over vores sundhed og udsætter naturen for at blive udsat for den her jordforurening, som ligger dernede? Så hvordan ser det ud? Jamen det er i hovedreglen de fem regioner, som har til opgave at sikre drikkevandet, naturen, og hvordan vi kan anvende de forurenede arealer, og det er altså vores regioner, der sammen med de 98 kommuner udpeger de grunde, som skal kortlægges. Og regionerne har så den opgave at fokusere på de forureninger, der netop udgør en risiko for drikkevand, for vandmiljø, for natur eller for menneskers sundhed. Det kan være i boliger. Det kan også være i børneinstitutioner. Det kan være offentlige legepladser. Det er klart defineret, hvad det er, man skal prioritere, og det er det, som ifølge jordforureningsloven kaldes de offentlige indsatsområder, og der er en rigtig, rigtig god faglig grund til, at man har fokuseret kræfterne på præcis de områder. Kan man så bygge hvor som helst i Danmark? Nej, det kan man naturligvis ikke. Der findes jo steder i Danmark, der er så forurenede, at uanset om det bare var en parkeringsplads, skal man ikke bygge på det sted. Der findes områder, som vi er i gang med at få renset op, som har været der i årtier, som man ikke skal bygge på, og som er et stort oprydnings- og oprensningsarbejde. Men uanset hvad er det sådan, at når man skal bygge på ny grund, og hvis der er en forurening – det kan være en lettere forurening, og det kan være en mere alvorlig – skal der jo tages stilling til, hvad det er for en forurening, der ligger fra tidligere tider, og hvad det er for nogle påvirkninger, det eventuelt vil kunne give, alt efter hvad det så er, man vil bygge. Derfor er den vurdering, som regionerne skal foretage, jo helt central, i forhold til hvilket krav der så skal stilles til grundejeren. Skal man flytte noget jord, rense det op? Hvad må du egentlig bygge, og hvad må du opføre af forskellige byggerier, funktioner, på de forskellige steder? Så der skal altså foreligge en faglig vurdering af, om det er sikkert at etablere et byggeri, og hvilket specifikt byggeri det så er, man kan etablere. Hvis vi er her i hovedstaden, hvor der jo hele tiden bliver bygget børnehaver, kan de så bygge dem alle steder? Nej, det kan de ikke. Der er mange steder, man ikke må bygge børnehaver her i hovedstaden, ligesom der er i andre byer – nu taler jeg bare lige om her i København. Så der er tiltag, der skal gøres. Fordi vi ved, at børnene leger i jorden ude på legepladsen, er der tiltag, der skal gøres for at sikre, at man ikke kan bygge alle steder. Og hvis man bygger et sted, skal man finde ud af, hvor forurenet jorden er, og så skal man tage initiativer, der sikrer, at jorden enten renses op eller på anden måde håndteres. Sådan er det i hovedstaden, men sådan er det også langt, langt de fleste steder i Danmark. Det er et vigtigt arbejde, for vi skal selvfølgelig ikke have, at vores børn eksponeres for den jordforurening, som desværre ligger alt, alt for mange steder i Danmark. Dermed også sagt, at der jo er forskel på, om det er en parkeringsplads, man vil anlægge, eller om det er en legeplads, man vil anlægge. Det giver sig selv, og det er jo præcis det, der ligger i reglerne. Når man har foretaget en vurdering af, hvad det er for en forurening, der er tale om – den gamle forurening, der desværre ligger alt for mange steder – kigger man på, hvad der skal anlægges, og hvad man kan få lov til at anlægge. Det er klart, at jeg ville lægge flere p-pladser oven på forurenet jord end børnehaver. Børnehaver kan vi jo ikke have på forurenet jord. Jeg fik en status af ministeriet op til den her debat i dag for at høre, hvor udbredt det er, og det er jo udbredt, som jeg startede med at sige. De seneste tal, jeg har, og som er fra 2022, viser, at der var 627 grundejere, der fik en tilladelse til noget bygge- eller anlægsarbejde på et areal, der er defineret af en eller anden grad af forurening – 627 bare på 1 år! Det siger jo meget godt, at det er over det hele i Danmark, og det handler altså om, hvilken forurening der er, og hvad man vil bruge grunden til. Hvad skal du rense op, og hvad kan du gøre uden at kompromittere naturen og uden at bringe menneskers sundhed og sikkerhed i fare. Det er den lovgivning, vi har i dag, der skal sikre, at byggeriet kan ske i trygge rammer. Det gælder både, når der bygges – det er jo i arbejdsmiljølovgivningen, det primært henhører – og når byggeriet er afsluttet og man tager arealerne i brug. Det handler jo om menneskers sundhed og selvfølgelig også generelt, at når man begynder at rode op i noget, der er forurenet, kan man risikere, at der er en påvirkning af det omkringliggende miljø. Det er jo rigtigt, at de forurenede arealer på mange måder er et udtryk for fortidens synder, som stadig væk ligger i vores omgivelser, og som vi jo så har opgaven at håndtere på en forsvarlig måde. Det er vel ingen hemmelighed, at når vi har så omfattende et problem og alt for mange steder så alvorlig forurening, er det en stor opgave. Det kan alle regne ud. Det er en stor opgave, vi har i vores samfund med at sikre, at vi afleverer et land med mindre forurening – vi kalder det jo generationsforureninger, i hvert fald dem, der er helt slemme – så næste generation ikke arver lige så mange generationsforureninger, men gerne skulle have et Danmark, som er grønnere, renere og ikke har så meget forurening i sig. Alle ved, at det ikke kan løses med et snuptag. Det er et virkelig kompliceret arbejde, der skal til, og som selvfølgelig også har nogle omkostninger, men det er en regning, vi er nødt til at være klar til at betale. Det kræver også, at man fokuserer indsatsen og selvfølgelig bruger midlerne, hvor forureningen udgør den største trussel. Vi har jo så princippet i Danmark om, at forureneren betaler. Det er et fuldstændig klart princip: Forureneren betaler. Problemet her er jo, at det er så mange årtier siden, de her jordforureninger opstod, at det ikke er muligt i desværre alt for mange tilfælde at gå efter forureneren. Jeg synes, at det er et rigtigt princip moralsk og juridisk, men i de desværre for mange tilfælde, hvor forureneren ikke kan betale, og hvor vi ikke kan finde frem til forureneren, er det regionerne, som løfter opgaven. Og hvad bruger regionerne på det om året? Jeg nævnte, at det er omkostningsfuldt. Udgifterne ligger på cirka 0,5 mia. kr., altså 500 mio. kr., om året på oprensning af jordforurening. De målretter indsatsen, således at de fokuserer på de steder, hvor der er den største risiko for vores drikkevand, natur, overfladevand eller selvfølgelig boligområder. Det er også en vanskelig prioritering, og den prioritering har vi eksperter, der foretager, men det er en vanskelig prioritering. Jordforureningsloven har eksisteret i Danmark i 25 år, og den skal altså hjælpe til, at man kan prioritere. Der er i den finanslovsaftale, der blev indgået for 2021, lagt yderligere midler oveni. Det er en gammel finanslovsaftale, men alligevel er der virkelig grund til at give et klap på skulderen til de partier, der bar det ind og var med til at lave en aftale om at afsætte yderligere 630 mio. kr. netop til oprensning af generationsforureninger, for det er der, vi har de allerallerstørste jordforureningsproblemer. Det kommer altså oven i de 0,5 mia. kr., som der bliver brugt om året i vores regioner til den her opgave. Som grundejer bliver man altså mødt af forskellige myndighedskrav, afhængigt af om det er forurenet jord, hvor forurenet den er og hvad det så er, man vil udnytte det areal til. Det giver sig selv, at jo mere forurenet grunden er, jo mindre kan man få mulighed for at bruge den til, og nogle steder skal man simpelt hen gå ind direkte at oprense. Det er så også sådan, at de her jordforureninger, som ligger årtier tilbage, ligger dybt nede i jorden, dvs. at det kræver nogle undersøgelser at finde det frem. Men det er også sådan, at eksperterne fra sted til sted vurderer, hvordan vi bedst passer på miljøet, hvor risikoen er det pågældende sted, om det er en risiko at begynde at grave op i det, eller om det er bedre at kontaminere, altså ikke at grave op i det. Er det bedre at lade jordforureningen blive liggende? Det er en konkret vurdering, som eksperter laver, ud fra hvor det bæredygtigt er mest fornuftigt: Er det at opgrave og flytte rundt på forurenet jord, der jo så skal behandles og forsøges renset op et sted, hvad det så betyder af mulige forureningskilder, og at man så skal finde noget rent jord og putte ned i stedet for – kan det lade sig gøre, og er det den bæredygtige løsning? – eller hvad er den bæredygtige løsning de konkrete steder? Det afhænger af specialister og den helt konkrete forurening, der er tale om. For mig at se må den politiske opgave her være at sikre, at der er midler nok, at der er fokus nok på den her opgave, og at eksperterne kan vurdere, om det er farligt, om det er sundhedsforsvarligt, og hvad påvirkningerne af vores miljø er. Der må vi jo alle sammen, også grundejerne, så efterkomme de ønsker, der er, og acceptere, at hvis der er en besked om, at her må der kun bygges parkeringspladser, så er det sådan, det er, eller at her skal der renses op, så må det være det, man må gøre. Der er altså nogle regler, og som jeg forstår det, handler forslaget også om nogle generelle eftersyn af jordforureningsloven. Reglerne her mener jeg er fornuftige, fordi de fokuserer på de fire vigtigste områder. Det er drikkevand, det er vandmiljø, det er natur, og det er menneskers sundhed i boliger og i børneinstitutioner. Det er det primære fokusområde, som ligger i jordforureningsloven, og det mener jeg er fornuftigt. Så vi har altså et system for anvendelse af forurenede grunde, hvor regionerne har til opgave at vurdere den risiko, som forureningen udgør for drikkevand, natur og menneskers sundhed, og hvor myndighederne så sammen ser på, hvordan arealet vil kunne anvendes, og hvilke tiltag der vil skulle til, for at man vil kunne anvende et areal. Hvis det er nødvendigt, stilles der krav, som afspejler den fremtidige planlagte anvendelse af arealet. Det vil sige, at der også er en kæmpestor forskel. Nogle steder må man meget, fordi jorden er ren, andre steder må man mindre, fordi jorden er lettere forurenet, og andre steder igen må man intet, fordi jorden er meget forurenet. Det er den måde, det er sat op på, og det synes jeg vi skal støtte. Derfor vil jeg sige, at jeg synes, at den nuværende lovgivning er god. Det, der skal turbo på, er at sikre, at der er midler nok til, at oprensningen af ikke mindst generationsforureningerne kan fortsætte som planlagt.",778.0,16:00:54,11662,10884,3:01:24,3:14:22,40
Bjarne Laustsen,Tak til miljøministeren. Der er lige en kort bemærkning til fru Marianne Bigum fra SF. Værsgo.,4.0,16:13:52,11666,11662,3:14:22,3:14:26,40
Marianne Bigum,"Mange tak. Jeg kan forstå, at ministeren mener, at den nuværende lovgivning er god. Men mit spørgsmål til ministeren er egentlig, om ministeren slet ikke kan se, at der faktisk er behov for at gøre noget mere. Ministeren siger selv, at vi har kæmpe problemer i Danmark med jordforurening. Vi sidder i sparsomme finanslovsforhandlinger og prøver at finde penge, som ikke på nogen måde er tilstrækkelige, til generationsforureningerne, og så er der også alle de andre forureninger, hvor der mangler midler. Det er derfor, SF mener, at ministeren skal kigge på den her jordforureningslov igen, i forhold til om ikke vi kan gøre noget mere. Det, vi faktisk konkret foreslår, er jo, at man i forhold til de her stærkt forurenede grunde, som man går ind og bygger på, simpelt hen får renset op, inden man sætter nye bygninger ovenpå. Altså, det er jo der, der er en åbning, i forhold til at det er billigere og nemmere at komme til forureningerne. Der er også det, at man kan dele regningen med en bygherre eller få det til at indgå i prisen, mens det, hvis vi venter til på et eller andet tidspunkt, hvor det er efterladt til det offentlige, så bliver rigtig svært. Kan ministeren slet ikke se, der er behov for noget mere i forhold til jordforureningsloven?",70.0,16:13:56,11736,11666,3:14:26,3:15:36,40
Bjarne Laustsen,Værsgo til miljøministeren.,1.0,16:15:06,11737,11736,3:15:36,3:15:37,40
Magnus Heunicke,"Helt grundlæggende er det forureneren, der skal betale, og hvis vi har at gøre med nogen, der forlader et område, sælger et område, hvor de har forurenet, så er det forureneren, der skal betale. Det ville så være rimelig nemt at finde ud af, hvem det er, der har haft området, og hvad det er, der er sket af aktiviteter, som gør, at vi altså nu har en forurening på det her område. Jeg er helt enig i, at midlerne er sparsomme, når vi sidder og forhandler. Dog synes jeg, det var et betragteligt beløb, man afsatte der i 2021. Der er jo også drøftelser af det arbejde, der foregår i vores regioner, med netop at rense op efter generationsforureningerne, og om, hvad der så er behov for. Der er udbud i gang osv. Men jeg vil være meget, meget lydhør over for, hvad det er, eksperterne siger derude, altså hvad det er, der konkret skal se. For nogle steder vurderer de jo, at man ikke skal rydde op i den forurenede jord. Der er ikke noget rent jord at putte i i stedet for, og det er bedre, at den forurening, der er, er indkapslet, end at der bliver ryddet op i den. Det er jo en konkret vurdering, som eksperterne må foretage derude.",68.0,16:15:07,11805,11737,3:15:37,3:16:45,40
Bjarne Laustsen,Tak. Ordføreren.,2.0,16:16:15,11807,11805,3:16:45,3:16:47,40
Marianne Bigum,"Man kan også kigge lidt tidsmæssigt på det, og ministeren nævner selv, at den her lov er 25 år gammel. Noget af det, der indgår i vores beslutningsforslag her, er, at man også opdaterer den i forhold til klimahensyn. Vi ser, hvordan vores klima simpelt hen er markant anderledes, i forhold til hvordan det plejede at være, og ministeren har selv for nylig været ude at kigge på det i Randers. Ser ministeren ikke, at der måske ud fra et klimaperspektiv er behov for at revidere den 25 år gamle lovgivning og gøre den mere tidssvarende?",28.0,16:16:17,11835,11807,3:16:47,3:17:15,40
Bjarne Laustsen,Værsgo til miljøministeren.,1.0,16:16:45,11836,11835,3:17:15,3:17:16,40
Magnus Heunicke,"Jeg tror, det er for tidligt at sige, at jordskredet i Randers skyldes klimaforandringer, og at man ikke kunne have forudset og opereret inden for den risiko, som der er, med mere våde sæsoner, som vi jo har haft sidste år. Men der er ingen tvivl om, at når det handler om behandling af giftig jord og giftigt vand, som det her er, så skal man være klar over, at vejret kan være mere voldsomt, end det var tidligere. Det er klart.",36.0,16:16:46,11872,11836,3:17:16,3:17:52,40
Bjarne Laustsen,"Tak. Der er ikke flere korte bemærkninger, så vi går over til ordførerrækken. Så er det fru Anne Paulin fra Socialdemokratiet som ordfører. Værsgo.",15.0,16:17:22,11887,11872,3:17:52,3:18:07,40
Anne Paulin,"Tak for det. Beslutningsforslaget, som vi behandler nu, er fremsat af SF og handler om jordforurening, som jo desværre er et stort problem mange steder i Danmark. De seneste år har vi også set kendte generationsforureninger, som er vokset i kompleksitet og omfang. Der er nye udfordringer med PFAS-forurening, som også er kommet til og skal håndteres. Dertil kommer en række andre typer af forureninger, f.eks. fra benzin og olie, og lige aktuelt ser vi jo med sagen om Nordic Waste i Randers, at det kan have store konsekvenser for natur, miljø og sundhed, når farligt affald ikke håndteres, som det bør og skal. Derfor er jordforurening naturligvis et vigtigt emne. Samlet set er der registreret 38.500 grunde med jordforurening i de danske regioner, som står for den offentlige indsats på området. Med over 38.000 lokaliteter i hele Danmark er det et stort omfang. Så meget desto vigtigere er det også, at indsatsen prioriteres bedst muligt, og når Socialdemokratiet i dag stemmer nej til det her beslutningsforslag, så er det, fordi vi grundlæggende synes, at der er nogle fornuftige balancer allerede i den nuværende jordforureningslov, som sikrer, at midlerne og indsatsen prioriteres bedst muligt. F.eks. giver det mening, at der stilles forskellige krav, alt efter om der skal bygges en parkeringsplads eller en børnehave oven på et område med jordforurening. Med SF's forslag til udvidelse af arealer, som skal være omfattet af jordforureningsloven, vil over halvdelen af Danmarks areal kunne blive omfattet. Er det hensigtsmæssigt? Det mener vi ikke. Derfor støtter Socialdemokratiet ikke det her beslutningsforslag, uagtet at vi naturligvis finder den her diskussion om jordforurening vigtig, og vi har jo ogsåhar været med til at sikre flere midler til oprensning af bl.a. de store generationsforureninger.",120.0,16:17:37,12007,11887,3:18:07,3:20:07,40
Bjarne Laustsen,Tak. Så er der en kort bemærkning fra fru Marianne Bigum fra SF. Værsgo.,5.0,16:19:37,12012,12007,3:20:07,3:20:12,40
Marianne Bigum,"Mange tak for det. Vi gør jo faktisk noget i forhold til den her dagsorden. Vi synes bare ikke, at vi gør nok. Til det der med – det blev også sagt af ministeren før – at der skal være forskel på, om det er en daginstitution, eller om det er en parkeringsplads, vil jeg sige: Ja, men vinklen på det er jo, at der er forskel på, om man er der meget eller ikke. Når vi også synes, at man skal gå ind og kigge på anlægsbyggerier, handler det jo også om, at man får afgrænset det, så der er mulighed for at få ryddet op i noget jord. Altså, forurenet jord under en parkeringsplads, en motorvej eller sådan noget kan jo forurene natur og miljø. Det er der, vi går ind og siger: Inden vi bygger, skal vi rydde op. Ordføreren siger det jo selv i forhold til det med, at det måske var halvdelen af Danmark, man skulle gøre noget ved. Ja, det understreger lidt størrelsen af problemet. De her forureninger bliver der jo ikke nødvendigvis altid. De kommer til at sive ud, og særlig når vi ser klimaforandringerne med stigende vandstand, grundvandsspejl og alt muligt andet, så ændrer det fuldstændig forudsætningerne for det, vi har troet vi har kunnet indkapsle. For det kan vi simpelt hen ikke. Er ordføreren ikke enig i det?",68.0,16:19:42,12080,12012,3:20:12,3:21:20,40
Anne Paulin,"Ja, og derfor skal der jo selvfølgelig også altid være en myndighedsvurdering af de her ting, men der kan så også være eksempler, hvor det måske giver bedst mening, at jorden bliver liggende, hvor den er. Det er jo heller ikke konsekvensfrit, når man begynder at flytte rundt på farligt affald og skal håndtere det. Nogle gange kan det være indkapslet i tilstrækkelig grad til ikke at gøre skade på det nærliggende vandmiljø osv. Så det er jo også noget, der fra case til case afhænger af, hvad de konkrete forhold er. Men selvfølgelig er det vigtigt, at vi har en myndighed på det her område, som holder øje med, hvad der sker.",48.0,16:20:50,12128,12080,3:21:20,3:22:08,40
Bjarne Laustsen,Værsgo til spørgeren.,2.0,16:21:38,12130,12128,3:22:08,3:22:10,40
Marianne Bigum,"Så vil jeg spørge, om ordføreren er med på, at forslaget ikke går påalleforurenede grunde i Danmark, men på deciderede affaldsdepoter og stærkt forurenede grunde, altså det, vi har kaldt kemiske hotspots. Så det er ikkeallegrunde, som sådan set skal oprenses, men lad os starte med der, hvor vi har nogle alvorlige udfordringer.",21.0,16:21:40,12151,12130,3:22:10,3:22:31,40
Bjarne Laustsen,Værsgo til ordføreren.,2.0,16:22:01,12153,12151,3:22:31,3:22:33,40
Anne Paulin,"Ja, jeg er med på, at der jo er nogle forskellige elementer i det her beslutningsforslag. Noget af det handler om at udvide jordforureningsloven. Så er der den her del, som mere handler om forbuddet oven på de her områder. Jeg synes stadig væk, at der er en væsentlig nuance, i forhold til hvilket område man bygger oven på. Er det parkeringspladser, er det trods alt mindre problematisk, end det er, hvis det er børnehaver eller et sted, hvor folk bor og er i kontakt med jorden nedenunder.",36.0,16:22:03,12189,12153,3:22:33,3:23:09,40
Bjarne Laustsen,Tak. Så er der en kort bemærkning fra hr. Søren Egge Rasmussen fra Enhedslisten. Værsgo.,5.0,16:22:39,12194,12189,3:23:09,3:23:14,40
Søren Egge Rasmussen,"Nu kunne jeg jo forstå på ordføreren, at ordføreren mente, at den nuværende lovgivning var god nok. I det her beslutningsforslag er der ridset op, at vi kan have nogle særlige problemstillinger, fordi vi oplever nogle klimaforandringer og vi har noget grundvandsstand, som kommer højere op. Det er jo sådan set nogle nyere problemer, som vi har oplevet på det seneste. Er ordføreren helt sikker på, at vi er i en situation, hvor vi har lovgivning, som tager hånd om de nutidige problemer?",34.0,16:22:44,12228,12194,3:23:14,3:23:48,40
Bjarne Laustsen,Værsgo til ordføreren.,2.0,16:23:18,12230,12228,3:23:48,3:23:50,40
Anne Paulin,"Selvfølgelig skal vi holde øje med, hvordan de vejrmæssige forandringer udfordrer vores evne til at kunne håndtere farligt affald, jordforurening osv. Det var sådan set også det, som ministeren sagde. Men det ændrer ikke på, at vi på baggrund af det her beslutningsforslag lige nu og her ikke mener, at der skal laves en ny revidering af den nuværende jordforureningslov.",28.0,16:23:20,12258,12230,3:23:50,3:24:18,40
Bjarne Laustsen,Værsgo til spørgeren.,2.0,16:23:48,12260,12258,3:24:18,3:24:20,40
Søren Egge Rasmussen,"Det var da lidt et skuffende svar. Nu kan jeg forstå på ordføreren, at det ikke er så alvorligt, hvis man bygger en parkeringskælder oven på noget forurenet jord. Med hensyn til hvad der kan bygges oven på forurenet jord, vil jeg pointere, at man jo har planlagt at bygge rigtig meget oven på forurenet jord. Jeg tænker på Lynetteholmen, hvor der modtages forurenet jord i ret store mængder, og efterfølgende vil man så lave en ny bydel, hvor der kommer beboelse oven på forurenet jord. Er ordføreren helt tryg ved den planlægning, der foregår i København, omkring det?",38.0,16:23:50,12298,12260,3:24:20,3:24:58,40
Bjarne Laustsen,Værsgo til ordføreren.,2.0,16:24:28,12300,12298,3:24:58,3:25:00,40
Anne Paulin,"Jeg mener, at det er helt afgørende, at der selvfølgelig laves vurderinger af de konkrete sager. Jeg kender jo ikke alle detaljerne i forhold til Lynetteholmen, men jeg har tillid til, at de myndigheder, som skal gå ind at vurdere forholdene i de her projekter, gør det efter bedste evne, så vi sikrer, at der ikke kommer sundhedsmæssige skader forbundet med det i forhold til de folk, som skal være i nærheden af de her områder.",30.0,16:24:30,12330,12300,3:25:00,3:25:30,40
Bjarne Laustsen,"Så siger vi tak til Socialdemokratiets ordfører, fru Anne Paulin. Og så siger vi velkommen til Venstres ordfører, hr. Erling Bonnesen. Værsgo.",12.0,16:25:00,12342,12330,3:25:30,3:25:42,40
