name;text;duration;start_clock;end_sec;start_sec;start_min;end_min;video_id
Rosa Eriksen;Tak for ordet. I Moderaterne kommer vi ikke til at stemme for dette beslutningsforslag af flere grunde. I Moderaterne er vi meget enige i, at de ældre beboere på plejehjem og dem, der modtager pleje i eget hjem, skal være trygge ved den pleje, de får. Det er både dem, der udfører arbejdet, der skal være trygge – de skal have de nødvendige kompetencer – men det er også trygheden ved, at der er en rigtig, rigtig god kommunikation plejepersonalet imellem og mellem medarbejder og borger. Vi mener, at det er de enkelte kommuners og plejehjemsledelsers ansvar og opgave at sikre, at de medarbejdere, der er ansat, er kompetente til deres opgaver. Jeg er sikker på, at kommunerne gør alt, hvad de kan, for at sikre dette, og der vil selvfølgelig være en vis forventning til, at medarbejderen kan kommunikere og indgå i dialog med den ældre på samme sprog, men det betyderikke, at vi skal lovgive på området centralt, altså herindefra. I Moderaterne tror vi på, at det er vigtigt at værdsætte mangfoldigheden i vores arbejdsstyrke, og at nationale standarder for sprogfærdigheder ikke nødvendigvis er ensbetydende med en ringere kvalitet af pleje. Meget af vores nuværende ældrepersonale har værdifulde og uundværlige kompetencer og erfaringer, der i høj grad værdsættes. I stedet for at opfinde nationale løsninger på de lokale problemer, bør vi i stedet arbejde på at forbedre vilkårene for vores ældrepersonale i de enkelte kommuner og dermed sikre, at de har de nødvendige ressourcer og støtte til at udføre deres arbejde. Derfor er jeg rigtig glad for, at regeringen har udarbejdet og lige så småt er ved at præsentere den nye ældrereform, der grundlæggende vil frisætte ældreområdet. Tak for ordet.;128.0;19:51:42;24863;24735;6:52:15;6:54:23;44
Pia Kjærsgaard;"Jeg må indrømme, at jeg bliver mere og mere spændt på, hvad den ældrelov kommer til at indeholde, for det virker, som om de alle sammen bare skal klare det ude i kommunerne; men det er jo det, kommunerne i hvert fald indtil videre ikke har været særlig gode til. Jeg bliver bare mere og mere forundret, for jeg synes at det her er så centralt og så vigtigt – det er måske i virkeligheden det allermest vigtige i forhold til ældreplejen. Og så må jeg bare sige i forhold til det spørgsmål, jeg stillede før til hr. Hans Christian Schmidt, omkring læger, at man faktisk i forhold til læger har et sprogkrav. Hvorfor har man det så ikke til sosu'er?";33.0;19:53:52;24898;24865;6:54:25;6:54:58;44
Pia Kjærsgaard;Måske. Men så tror jeg bare, at der kommer et økonomisk spørgsmål omkring det, altså hvor meget kan det lokale klare? Og derfor er det min vurdering, at når vi alligevel skal have en ældrelov, som tager hånd om rigtig mange ting herindefra, så burde nationale standarder også være en del af det. For jeg er helt sikker på, at fru Kirsten Normann Andersen og jeg og andre er enige om, at faste teams er noget, som bør til at indgå i ældreloven. Jeg savner også mange andre ting. Der kunne også være det med medicinering og mange af de ting, vi har diskuteret før. Det tror jeg er noget, vi kan få ind i den nationale ældrelov, og det tror jeg faktisk at man lokalt rundtomkring ville være glad for. For så slipper man rent ud sagt for det, ikke fordi man gerne vil slippe, men fordi det giver øget arbejde, mens man måske ikke har de økonomiske ressourcer og mangler nogle ressourcer. Så derfor er det vigtigt, synes jeg, at vi gør det herindefra.;56.0;20:33:42;27311;27255;7:34:15;7:35:11;44
Pia Kjærsgaard;"Men hvis ikke kommunerne, som ministeren siger, skal håndtere problemerne med ældreomsorgen, hvad er det så for nogle andre problemer? Altså, det med dansk er jo meget, meget vigtigt – det er for mig det første punkt, der står på dagsordenen – og ikke bare et dansk, der er sådan nogenlunde. For der kan være mange måder at lære dansk på, afhængigt af hvor man kommer fra. Og der kan være et ældre menneske, som kan have mistet et eller andet, og som måske ikke ligesom os andre lige umiddelbart kan fange, hvad der bliver sagt. Derfor er det meget, meget vigtigt, at dansk har topprioritet, og derfor skal der være en national standard, og det er ligegyldigt, om det er på Lolland eller i Sønderjylland eller i Skagen, eller hvor det er; så skal der være en national standard.";45.0;19:17:12;22710;22665;6:17:45;6:18:30;44
Charlotte Bagge Hansen;"Nu er regeringen bestående af tre partier. Der er en masse tiltag i gang nu; der er flere på tegnebrættet. Jeg gentager, hvad ministeren sagde: Det er altid velkomment at komme med nogle konkrete forslag. Vi synes, det er positivt. Vi ønsker alle sammen at sørge for at gøre det nemmere og bedre for både kommuner, stat og regioner at arbejde hen imod et bedre klima og miljø og med biodiversitet og klimatilpasning. Så jo mere der kommer på bordet, både regeringen og fra oppositionen, jo hurtigere kommer vi i mål.";47.0;15:10:25;7904;7857;2:10:57;2:11:44;40
Charlotte Bagge Hansen;Regeringen har gang i en masse tiltag. Der er flere tiltag på vej. Regeringspartierne tager meget gerne imod konkrete forslag, som ministeren har sagt. Jeg har sagt det mange gange nu heroppefra. Så kom med nogle forslag. Regeringen er altid villig til at høre på forslag. Der er masser af ting i gang og på tegnebrættet. Der bliver, som ministeren har sagt, indkaldt til forhandlinger. Der er allerede forhandlinger i gang. Det var min sidste bemærkning til det.;36.0;15:11:53;7981;7945;2:12:25;2:13:01;40
Charlotte Bagge Hansen;Nu pågår der jo noget arbejde med, at vi skal have lavet en naturlov, og her skal biodiversitet også omfattes. Om det skal være her eller der eller nogle andre steder, må jeg indrømme at jeg ikke kan tage stilling til. Det, som jeg siger, er, at jeg er tryg ved den måde, det foregår på, og de rammer og de hensyn, der bliver taget ud fra de vurderinger, som regionerne foretager. Sådan som de er nu, er jeg ganske tryg.;35.0;16:35:30;12997;12962;3:36:02;3:36:37;40
Charlotte Bagge Hansen;Nu bliver jeg ikke så berørt af det, ordføreren siger, fordi jeg ved, at ordføreren kender mig godt nok til at vide, at magtarrogance nok ikke lige er det, der ligger i min dna. Det, jeg opfordrer til, er: Kom med flere konkrete eksempler at sætte ind. For der er jo nogen herinde, der er uenige i, at vi skal sætte ind med alle de parametre, som vi kan, i den krise vi er i lige nu. Så kom med noget konkret. Der er ikke noget, der bliver fejet af bordet. Vi tager det hele op, og der bliver arbejdet hårdt og konstruktivt ovre i ministeriet. Så kom med jeres forslag.;43.0;15:07:50;7745;7702;2:08:22;2:09:05;40
Birgitte Vind;Jeg synes, vi skal huske, at når vi frisætter, handler det netop om, at man har frihed til at gøre noget. Og så skal man jo diskutere herinde, hvor meget kontrol vi så mener der skal være med den her frisættelse, specielt når det kommer til natur- og miljøområdet. Det er for at tage det som eksempel. Jamen så vil det jo påvirke andre kommuner. Det er rigtigt, at det selvfølgelig godt kan være positivt, men jeg hører også ministeren sige, at man jo ikke lukker nogen døre i forhold til, om der er andre emner, man kan tage op og se på. Der er jo ikke noget, der er statisk i politik, og det kan da godt være, at der vil være nogle områder, hvor vi, ligesom vi har gjort det med grønne bymidter, kan lave nogle aftaler, som vi kan sprede ud til flere kommuner.;45.0;14:49:39;6656;6611;1:50:11;1:50:56;40
Birgitte Vind;Igen skal vi huske, at natur og miljø er noget, vi deler med hinanden. Så hvad du gør i én kommune, og hvad du undlader at gøre i én kommune, påvirker også andre kommuner. Det gør det også i forhold til biodiversiteten. Derfor synes jeg ikke, det er så enkelt. Men ordføreren har fuldstændig ret i, at der også er lavet aftaler om bymidter osv. Det er også noget, vi sætter rigtig stor pris på, altså at lave de her aftaler. Men igen er det jo noget, vi stadig væk har hånd i hanke med og holder øje med og kan følge, så vi ikke går længere, end at vi også stadig væk her i Folketinget kan tage det overordnede ansvar.;35.0;14:47:49;6536;6501;1:48:21;1:48:56;40
Birgitte Vind;Hvis vi tager f.eks. hastighedsgrænserne i byerne, er det allerede sådan, at politiet faktisk skal ind over, inden man som kommune træffer en afgørelse. Det er jo, fordi det er godt, at der også er nogle fælles regler, som vi alle sammen kan orientere os efter. Der kan være nogle faglige hensyn, som politiet har kendskab til, og som man måske ikke har kendskab til i den enkelte kommune. Jeg synes, vi skal passe rigtig meget på med, at det her med frisættelse ikke bliver et buzzword, som vi kan skubbe foran os i alle sammenhænge. Vi er et lillebitte land, og derfor er fælles regler og retningslinjer, bl.a. når det kommer til natur- og miljøområdet, jo også nogle grundlæggende værdier, så vi ved, hvad vi har at rette os efter.;37.0;14:46:04;6433;6396;1:46:36;1:47:13;40
Birgitte Vind;Tak. Jeg anerkender fuldt ud behovet for, at vi hele tiden har øje på de udfordringer, der er, og som ministeren også redegjorde for, er Digitaliseringsstyrelsen jo sådan set i fuld gang med at udsende vejledninger. Tingene går simpelt hen så stærkt, og der bliver også nogle gange opdaget problemer, vi ikke har kunnet forudsige på forhånd, og som vi så skal til at forholde os til. Det er jo desværre sådan, det er på det her område lige nu, som ministeren også fik redegjort for. Men jeg anerkender fuldt ud, at der er behov for det, men jeg synes simpelt hen stadig væk, at vi må holde på, at når der nu er vedtaget en forordning, bliver vi nødt til at lægge os i kølvandet af det, der kommer derfra.;35.0;14:32:27;5629;5594;1:33:14;1:33:49;41
Rosa Lund;Hvis man har fået tildelt dansk statsborgerskab, er man jo dansker, og det er derfor, jeg grundlæggende ikke forstår den forskel, som Dansk Folkeparti laver. Danske statsborgere er danske statsborgere, uanset hvordan man vender og drejer det. Så må jeg bare tilføje til Dansk Folkeparti, at det jo er Dansk Folkeparti, der har haft held med, at det er så svært at blive dansk statsborger i dag, som det er. Det er ikke noget, man kan lægge over på Enhedslisten, desværre. Jeg ville da ønske, at det var os, der havde styret udlændingepolitikken de sidste 20 år, men det er det ikke.;37.0;17:13:20;15284;15247;4:14:07;4:14:44;41
Rosa Lund;Hvis man opfylder kravene til dansk statsborgerskab, skal man have et dansk statsborgerskab. Og det skal ikke være nogen hemmelighed, at vi i Enhedslisten synes, at kravene er for stramme i dag. Jeg synes ikke og vi synes ikke i Enhedslisten, at man skal straffes ved ikke at kunne få dansk statsborgerskab for noget kriminalitet, man har begået for 10 år siden. Det er heldigvis sådan i det her land, at man ikke er straffet for evigt. Det er sådan, vores straffesystem fungerer. Det er det straffesystem, vi tror på i det her land, fordi vi ikke tror på, at man skal være kriminel eller dømt for evigt. Det er bl.a. også derfor, at vi ikke går ind for livstidsstraf, som andre partier her i Folketinget gør.;44.0;17:15:13;15404;15360;4:16:00;4:16:44;41
Rosa Lund;Det er det simpelt hen ikke, hr. Mikkel Bjørn. Hvis man tænker eksemplet til ende, hr. Mikkel Bjørn, så ville du jo fratage en person, som havde begået kriminalitet, og som var blevet dømt ved danske domstole, som man skal, statsborgerskab. Det er vi ikke modstandere af i Enhedslisten. Jeg kan forstå, at Dansk Folkeparti har lidt svært ved at læse vores politik, men det lever jeg så fint med. Personen ville være blevet dømt, og så havde vedkommende fået frataget sit danske statsborgerskab, hvis det stod til Dansk Folkeparti, og så ville vedkommende jo sidde på et udrejsecenter et eller andet sted. Hvordan skulle det hjælpe nogen som helst? Og hvordan skulle det i øvrigt generelt sikre, at der ikke ville være kriminalitet i Danmark? Det er bare for sige, at hvis det var så nemt, ville der jo ikke være nogen kriminalitet i Danmark. Dansk Folkeparti har jo haft held med, desværre må jeg sige, at hæve straffene i det her land de sidste 20 år. Har det stoppet kriminaliteten i det her land, hr. Mikkel Bjørn – ja eller nej?;58.0;17:09:06;15051;14993;4:09:53;4:10:51;41
Fie Hækkerup;Jo, jeg vil sige det sådan, at det spørgsmål, som rejses her, i forhold til udenlandsk arbejdskraft, selvfølgelig også skal vejes ind i den videre proces med det her forslag. Det tænker jeg sådan set er en helt naturlig del af det. Jeg synes, som ministeren var inde på, at man med rette kunne kigge mod f.eks. Lolland, som allerede har gjort sig gode erfaringer med at tage imod udenlandsk arbejdskraft.;32.0;19:36:50;23875;23843;6:37:23;6:37:55;44
Fie Hækkerup;»Flersprogspædagogik« kommer fra vores social- og sundhedsuddannelsesudspil, så det er mig bekendt ikke i ældreloven, men det fremgår i hvert fald af sosu-udspillet. I virkeligheden går jeg ikke så meget op i, hvad det er for nogle ord, vi skriver i udspillene. Jeg går mere op i, om vi får skabt nogle løsninger, der faktisk virker derude lokalt. Det, jeg egentlig prøvede at sige med det, var, at jeg sådan synes, det er fornuftigt, at vi f.eks. uddanner vores undervisere på skolerne til at kunne løfte de sprogligt svage elever.;34.0;19:33:31;23678;23644;6:34:04;6:34:38;44
Fie Hækkerup;I virkeligheden tænker jeg det her sådan, at vi alle sammen er interesserede i, at medarbejderne kan kommunikere ordentligt med de ældre borgere. Det handler om, hvordan man anskuer og løser det her problem bedst muligt med de sprogbarrierer, som der kan være, hvis man har problemer med sproget – det kan også være ordblindhed og alle mulige andre ting, som besværliggør hverdagen. Der mener jeg, at man i højere grad løser det ved f.eks. at lave sprogstøtte, ved at lave sprogscreening og ved at opkvalificere underviserne til at kunne undervise i flersprogspædagogik end ved at indføre nationale standarder og mere detailstyring og kontrol, som er noget af det, som jo lige præcis tager tiden væk fra borgerne. Det er jo al den her detailstyring, al den her kontrol og det her tilsyn, som tager tiden væk den tid, der skal bruges til trygheden i ansigt til ansigt-kontakten.;64.0;19:31:47;23604;23540;6:32:20;6:33:24;44
Marlene Harpsøe;"Tak for svaret. Ministeren siger, der skal være lokal frihed og lokalt ansvar, og det kan jeg sådan set ikke være uenig i. Men samtidig fremlægger regeringen jo også et forslag om, at nu skal der mere sprogstøtte og sprogscreening til social- og sundhedselever. Det er jo dejligt, men det går måske lidt imod de tanker, som regeringen måske ellers havde på området; jeg skal ikke kunne sige, om der er noget dér. Når det så er sagt, siger ministeren: Kvaliteten skal være i orden, og man skal sætte nogle mål. Så hvordan får vi målt på kvaliteten i forhold til danskkundskaberne i ældreplejen? Hvordan vil ministeren sikre det?";36.0;19:20:48;22917;22881;6:21:21;6:21:57;44
Marlene Harpsøe;Så vil jeg da også selv stille mig op i rosekoret. Det er ikke nogen hemmelighed – jeg har sagt det offentligt mange gange – at da jeg var helt ung, havde jeg en plakat af fru Pia Kjærsgaard hængende på mit værelse. »Danmarks hjemmehjælp« stod der. Jeg har nemlig også altid kæmpet for hjemmeplejen, og det har fru Pia Kjærsgaard også gjort, så tak for det. Når det så er sagt, synes jeg, at der var sådan en lidt kedelig ordveksling tidligere i dag, foranlediget af, at fru Pia Kjærsgaard stillede mig et spørgsmål, mens jeg var på talerstolen som ordfører. Når jeg nu tager det op igen, er det jo, fordi jeg ikke synes, fru Pia Kjærsgaard stillede det rigtige spørgsmål til mig. Jeg synes, fru Pia Kjærsgaard skulle have stillet et spørgsmål til mig om, hvad det var, Danmarksdemokraterne så ville stemme til det her beslutningsforslag, hvis det kom til afstemning. Så havde jeg sagt, at vi ville stemme for, men fru Pia Kjærsgaard undlod at stille det spørgsmål. Det synes jeg bare er hamrende ærgerligt, og derfor vil jeg gerne lige sige, at vi altså stemmer for i Danmarksdemokraterne. Det mandat har jeg fået af folketingsgruppen tidligere i dag.;66.0;20:30:06;27105;27039;7:30:39;7:31:45;44
Marlene Harpsøe;Ministeren kaldte det her forslag om nationale standarder for danskkundskaber i ældreplejen for en bureaukratisk løsning  med mere kontrol med ældreplejen. Det er jo et synspunkt, men hvis vi skal gå planken ud, i forhold til hvad der er bureaukrati, og hvornår vi skal gribe ind fra Christiansborgs side og lave nogle regler eller ikke lave nogle regler, så kunne man også sige, at en del af regeringens forslag om at indføre mindre faste teams i ældreplejen jo også er at gribe ind, altså ved at man siger: I skal organisere jer på en bestemt måde. Men der er jo ingen herinde, der kunne drømme om at sige, at det var en dårlig idé. Faktisk er vi alle sammen enige om, at mindre faste teams er en god idé. Så hvornår er der tale om bureaukrati, og hvornår er der ikke tale om bureaukrati? Er det et spørgsmål om, hvem der fremsætter forslaget, altså om det kommer fra regeringen eller fra et oppositionsparti?;55.0;19:45:42;24430;24375;6:46:15;6:47:10;44
Louise Brown;Tak for svaret, minister, og jeg er enig i, at vi både har en udfordring med fertiliteten, hvor ministeren også nævner, at hver fjerde har udfordringer, men jo også med en befolkningsvækst, der går den forkerte vej. Men tiden er også afgørende for sådan et vellykket fertilitetsforløb, og som vi lige var inde på, er der ventetider. Den her ufrivillige barnløshed og fertilitetsbehandlingerne kan nemlig være ekstremt opslidende, som ministeren også var inde på, og der er grænser for, hvor længe kvinden og parforholdet kan holde til den slags. Det er enormt indgribende at skulle stikke sig konstant, at skulle ændre på cyklussen, at skulle opleve at have scanninger på klinikken aflyst, eller hvor det ændrer sig med kort varsel. Så det er noget, der griber ind i hele familien og parforholdet på en ret vild måde, og kvindens alder er jo også en faktor for at have en god chance for succes. Uret tikker jo, og det gør det også, når man begynder i et forløb på en fertilitetsklinik, og den her ventetid kan være gift for sådan et forløb. Venstre og Liberal Alliance har jo tidligere været enige om flere dele af den her debat. Vi i Liberal Alliance har i vores seneste sundhedsudspil foreslået at udvide udrednings- og behandlingsgarantien på netop det her område til også at omfatte fertilitetsbehandlingen. Og det er ifølge Venstres hjemmeside også Venstres politik, og ministeren var lidt inde på det, men er det stadig sådan? Vil Venstre gerne udvide både retten til udredning og behandlingsgarantien til også at omfatte fertilitetsområdet?;96.0;13:34:46;2229;2133;0:35:33;0:37:09;41
Louise Brown;Det afgørende problem i den her danske fertilitetsbehandling er for mig at se ikke antallet af forsøg, eller at man selv skal betale for forsøg nummer to. Lige nu er det store problem de ventetider, der er, og at man også kan opleve at blive afmeldt sådan en behandling i flere måneder, simpelt hen på grund af manglende kapacitet. Det må jo være frygteligt, når man så ved, at der netop er en mulighed derude i det private, som i dag faktisk også varetager over halvdelen af de fertilitetsbehandlinger, der er i vores land. Så det er glædeligt at høre, at ministeren gerne vil kigge på det her område. Hvornår skal vi så i gang med det?;38.0;13:37:09;2314;2276;0:37:56;0:38:34;41
Karina Lorentzen Dehnhardt;Jamen det er mig, der takker. Og jeg kan konstatere, at vi er et stort mindretal, der trods alt ønsker at sætte det her i gang. Det håber jeg at regeringen lytter til, ligesom jeg også håber, at regeringen lytter til de mange organisationer, som også peger på, at vi har behov for den her undersøgelse, herunder faktisk også Mandecentret. Jeg synes jo, at det er interessant, at det både er kvindeorganisationer og organisationer, der repræsenterer mænd, som mener, at vi har brug for mere viden på det her område. Jeg synes faktisk, at vi skylder ofrene at sikre, at det kommer.;36.0;17:43:51;17100;17064;4:44:24;4:45:00;44
Karina Lorentzen Dehnhardt;SF er et parti, der igennem ret mange år har krævet afbureaukratisering i politiet og har ønsket færre mål. Jeg ønsker ikke at indføre meget rigide bestemmelser for, hvordan et signalement skal udformes. Det må simpelt hen ligge inden for skiven af, hvad politiet selv kan arbejde med. Hvis hr. Mikkel Bjørn ønsker sig mere statistik på området, vil jeg foreslå, at man stiller et forslag om krav om statistik på området og ikke et krav om signalementer. Det mener jeg er den forkerte vej at gå.;32.0;16:12:47;11632;11600;3:13:20;3:13:52;44
Karina Lorentzen Dehnhardt;Nu har mine kollegaer jo taget fat på problemstillingen om, hvorvidt vi varetægtsfængsler for meget. Jeg tror, at selv hvis vi kiggede på alle de omkringliggende lande, ville vi nok komme frem til, at vi varetægtsfængsler langt mere end rigtig mange andre lande. Så der er nok noget, der tyder mere på, at Danmark stikker ud her, end at det er de andre lande, der varetægtsfængsler for lidt. Det, jeg gerne vil spørge til, er en lille flig af det, for jeg er meget optaget af børnene, altså de indsattes børn. Jeg synes jo, at børn skal have krav på kontakt med deres forældre. Der er faktisk rigtig mange af de her børn, som sidder og forestiller sig, at far er på vand og brød og sidder i en sort-hvid-stribet dragt med en kugle om benene, for det er det, de ser i tegnefilmene. De er enormt bekymrede for, hvad der jo typisk er en far. Men der er jo besøgs- og brevkontrol, og det spænder rigtig meget ben for, at de kan få besøg af de her børn, og hvis de får besøg, er det sådan noget, der ligger i institutionstiden eller i skoletiden, fordi der skal være en politimand til stede. Den type foranstaltninger overforbruger vi også. Så er det noget, ministeren kunne tænke sig at kigge på og sørge for, altså at besøg kan finde sted på tidspunkter, hvor det ikke går ud over skoletiden?;76.0;17:59:47;18096;18020;5:00:20;5:01:36;44
Sophie Løhde;Vi er i regeringen meget optagede af at hjælpe ufrivilligt barnløse og i det hele taget at styrke adgangen til fertilitetsbehandling i Danmark. Nedsat frugtbarhed er en af de mest udbredte sygdomme i dag. Op imod en fjerdedel af dem, som ønsker at blive forældre, oplever i dag problemer med at få det til at lykkes. Det er ekstremt hårdt og belastende at opleve ufrivillig barnløshed, og det har også store menneskelige konsekvenser for de berørte. Samtidig kan vi også se, at antallet af fødte børn i Danmark er faldende. Det er i sig selv en samfundsudfordring, som vi gerne vil gøre noget ved, og det er derfor, at vi gerne vil styrke fertilitetsindsatsen ved både at tilbyde flere forsøg, men også at give mulighed for at kunne få hjælp til det andet barn. Og det er derfor, at vi fra regeringens side har meldt ud, at vi nu er parate til og gerne vil investere et trecifret millionbeløb til bekæmpelse af barnløshed. Jeg er dog også enig med spørgeren i, at vi aktuelt i dag har udfordringer med ventetider til fertilitetsbehandling, og derfor vil vi jo bl.a. også bruge de penge, vi vil investere i fertilitetsbehandlingen, til at opbygge kapaciteten på de offentlige fertilitetsklinikker, så vi kan nedbringe ventetiden. Der vil også være en implementeringsperiode, men vi vil samtidig også have fokus på, hvordan vi kan bruge kapaciteten på de private fertilitetsklinikker og få dem inddraget til at kunne give hjælp. Det er noget af det, vi nu vil gå i dialog med bl.a. Danske Regioner omkring. Til gengæld er vores mål helt klart, nemlig at sikre, at der kan være en hurtigere adgang til fertilitetsbehandling.;101.0;13:33:03;2131;2030;0:33:50;0:35:31;41
Sophie Løhde;Nu står jeg her som indenrigs- og sundhedsminister på vegne af regeringen, men jeg vil da gerne give en serviceoplysning. For Venstre kom, synes jeg, inden folketingsvalget med et rigtig godt fertilitetsudspil, og vi har nu på ét år gennemført to ud af de tre forslag, som vi kom med, og jeg er rigtig stolt af, at vi har sørget for at sikre, at vi har kunnet sætte så mange flueben på så kort tid. Nu er jeg som indenrigs- og sundhedsminister også optaget af, at vi skal have bekæmpet de alt for lange ventetider, og det er egentlig også derfor, jeg har et meget fordomsfrit blik i forhold til at sige, at når vi nu skal have opbygget kapaciteten, så lad os da også gå ind i en dialog omkring, hvordan vi kan bruge de private aktører til at sikre, at vi kan give parrene og de enlige kvinder en hurtigere adgang til fertilitetsbehandling i Danmark.;46.0;13:36:22;2275;2229;0:37:09;0:37:55;41
Betina Kastbjerg;Jeg synes jeg også, jeg nævnte i min tale, at det var vigtigt for os. Men der er også et hensyn i forhold til det her beslutningsforslag, som ikke er nævnt af Dansk Folkeparti. Der står, at man vil tage de økonomiske konsekvenser, og i det her forslag henviser man til, at det må kunne tages inden for den eksisterende ramme. Det tror jeg bare ikke man kan. Jeg tror, det her er lidt mere ressourcekrævende, end Dansk Folkeparti måske forestiller sig, både for domstolene og for politiet. Og det er det, vi gerne vil have undersøgt, inden vi ligesom kan tage endelig stilling til, om vi kan tilslutte os det eller vi ikke kan.;31.0;16:22:47;12231;12200;3:23:20;3:23:51;44
