name;text;duration;start_clock;end_sec;start_sec;start_min;end_min;video_id
Betina Kastbjerg;Som jeg også nævnte i min tale, er vi af den overbevisning, at politiet faktisk udsender de rigtige signalementer, når de sender en efterlysning ud. Der kan jo være nogle efterforskningsmæssige hensyn at tage, når man udsender et signalement, men jeg synes, at i mange af de tilfælde, som jeg læser mig til i mit lokalområde, skriver man det. Bl.a. i forbindelse med det der forsøg på kidnapning af to piger i Herning udsender man et signalement: To mænd, der er brune i huden. Så jeg synes, at medierne gør det, og vi kan jo nok ikke herindefra lovgive om, hvad medierne skriver om, og hvordan medierne formidler et signalement, men jeg synes i hvert fald, at jeg oplever, at man ofte skriver det.;40.0;16:21:33;12166;12126;3:22:06;3:22:46;44
Betina Kastbjerg;Tak for ordet. I Danmark varetægtsfængsler man, hvis den sigtede har gjort noget strafbart, som har en strafferamme på 1 år og 6 måneders fængsel. Derudover skal dommeren vurdere, at der er en risiko for, at den sigtede flygter, at den sigtede vil begå nye lovovertrædelser, eller at den sigtede vil prøve at forhindre opklaringen af sagen, f.eks. ved at slette sine spor eller påvirke vidner eller medgerningsmænd. Det synes jeg sådan set er ret fine argumenter for at varetægtsfængsle. I Danmarksdemokraterne ønsker vi ikke, at gerningsmænd, som kunne være sigtet for frygtelige forbrydelser, skal kunne gå frit rundt og kommunikere med omverdenen og potentielt obstruere en efterforskning, som vi så det med ubådssagen. Vi mener i Danmarksdemokraterne heller ikke, at vi af hensyn til f.eks. ofre for personfarlig kriminalitet kan tage så store hensyn til gerningsmanden, som det i så omfattende grad foreslås med forslaget. Det er vores klare overbevisning, at for at bevare borgernes retsfølelse og retssikkerhed er det nødvendigt, at varetægtsarrestanter forbliver bag lås og slå. I Danmarksdemokraterne står vi altid på offerets side. Forslagsstillerne henviser til svaret på spørgsmål 382 fra Retsudvalget af 6. marts 2023 om hyppigere og længere varetægtsfængslinger. Men tabellen siger jo noget andet. Her kan man se, at antallet af varetægtsfængslinger er faldet støt fra 2014 til 2022. Til gengæld er det korrekt, at de varetægtsfængslede sidder længere i varetægt i 2022, end de gjorde i 2014. Men det skal jo bl.a. nok også ses i lyset af de lange ventetider hos domstolene. Nu har vi lige indgået en ny flerårsaftale om domstolene med henblik på at nedbringe de lange ventetider, så jeg forstår heller ikke helt grundlaget for at fremsætte beslutningsforslaget. Så i Danmarksdemokraterne kan vi ikke støtte forslaget.;102.0;18:33:30;20145;20043;5:34:03;5:35:45;44
Marie Bjerre;Det er jo korrekt, at udviklingen sker meget, meget hurtigt på det her område, og derfor er det også svært lovgivningsmæssigt at følge med. Forordningen om kunstig intelligens blev jo sådan set fremsat allerede i 2022 på et tidspunkt, hvor ikke engang ChatGPT havde fået sit folkelige gennembrud. Så derfor kommer lovgivningen jo på bagkant af udviklingen. Det er jo meget naturligt. Men jeg fastholder, at vi på ingen måde sidder på hænderne, og at vi er meget opmærksomme på at yde vejledning og rådgivning i brugen af kunstig intelligens. Det er også derfor, at Datatilsynet har udgivet vejledninger i forbindelse med offentlige myndigheders udvikling og brug af kunstig intelligens, og Digitaliseringsstyrelsen har altså også udgivet guides til både offentlige myndigheder og til virksomheder omkring brugen af kunstig intelligens. Så der sker jo meget på området i forhold til at vejlede og rådgive både offentlige myndigheder og virksomheder. Men for mig er det vigtigt, at den vejledning og rådgivning også bliver ved med at flugte med det, der kommer med kunstig intelligens-forordningen. Vi kan ikke gå videre end den.;61.0;14:21:56;5024;4963;1:22:43;1:23:44;41
Marie Bjerre;Der er ingen modstand mod hjælp og vejledning til vores virksomheder og offentlige myndigheder i forhold til brug af kunstig intelligens. Tværtimod mener jeg faktisk, vi har en meget stor opgave i at hjælpe, vejlede og rådgive vores virksomheder i brugen af kunstig intelligens. Men der, hvor uenigheden opstår, er, med hensyn til om vi skal anlægge et udvidet forsigtighedsprincip i forhold til kunstig intelligens-forordningen. Jeg mener, at den vejledning og rådgivning, vi giver vores virksomheder og offentlige myndigheder, skal følge forordningen og være inden for rammerne af det. Vi kan ikke begynde at lave nogle andre retningslinjer eller tillægge et andet princip, som ikke flugter med forordningen.;35.0;14:23:40;5102;5067;1:24:27;1:25:02;41
Marie Bjerre;Hvis det kun var 55 mio. kr., der afgjorde udviklingen af kunstig intelligens for Danmark, stod det skidt til. De 55 mio. kr. er afsat til en strategisk ramme for udvikling af kunstig intelligens for at presse på for yderligere investeringer i kunstig intelligens. Jeg tror, at ordføreren er enig med mig i, at det jo ikke er den offentlige stat, der skal investere i kunstig intelligens. Vores virksomheder skal med og investere i kunstig intelligens, og det er vigtigt for mig som digitaliseringsminister at få sendt et signal til vores erhvervsliv om at komme i gang. Der er masser af muligheder, og det er ikke os, der politisk skal være til hinder for at udnytte de kæmpe muligheder og potentialer, der er. Derfor mener jeg, det er vigtigt, at vi også fra offentlig side får sat en strategisk retning for kunstig intelligens.;43.0;14:24:46;5176;5133;1:25:33;1:26:16;41
Peter Kofod;Tak for det, og tak for en fin tale. Jeg synes egentlig, justitsministeren rammer mange balancer rigtigt og fornuftigt i sin tale. Jeg konfronteres en gang imellem af borgere, der sender mig enkeltsager og spørger, om det ikke er urimeligt, at f.eks. i den her situation er der ikke varetægtsfængsling og der er personen sat fri, indtil der kan ske noget andet. Nu stiller jeg et meget ledende spørgsmål, men det kan vel også være, justitsminister, at der er nogle sager, hvor vi faktisk varetægtsfængsler for lidt, altså hvor der, hvis vi havde den kapacitet i vores kriminalforsorg, der skulle til, og hvis vi førte den retspolitik, vi fuldstændig kunne drømme om, ville være situationer, hvor vi ville varetægtsfængsle mere eller længere, end vi gør i dag, ikke sandt, justitsminister?;47.0;18:03:52;18312;18265;5:04:25;5:05:12;44
Peter Kofod;"Tak for det, formand. Tak til SF for at fremsætte det her beslutningsforslag, og i særdeleshed tak til ordføreren, fru Lisbeth Bech-Nielsen, der jo om nogen har kæmpet den kamp om alt, hvad der handler om digitalisering og kunstig intelligens, i snart en halv menneskealder, både på og uden for Christiansborg. Jeg læste på et socialt medie her for nylig, hvor der blev diskuteret kunstig intelligens på Christiansborg, og en bekendt af mig havde skrevet i et kommentarfelt, at det dog var dejligt med kunstig intelligens på Christiansborg, for så var der dognogenintelligens på Christiansborg. Spøg til side. Jeg synes, det er helt åbenlyst, at vi selvfølgelig har brug for at diskutere det her. Jeg bliver en lille smule træt af, når vi har de her diskussioner, at der altid bliver henvist til et eller andet EU-spor, for når man tænker på, hvor vigtig den her dagsorden er, vil jeg sige: Hvad har vi lært af andre dagsordener, der er vigtige? Det er, at hvis de er så vigtige, er det en dum idé at overlade det til EU. Så er det i hvert fald noget, som vi har brug for at diskutere rigtig meget selv; det kan også være, at vi har brug for at diskutere det i EU-regi, men det giver enormt god mening, at vi også diskuterer det her. Det giver også mening, at Danmark som et af de mest digitaliserede lande i Europa selvfølgelig har en stærk stemme i det her blandt andre lande, og at vi har en minister, som er aktiv over for andre lande i det arbejde, der foregår i Bruxelles. Så langt hen ad vejen er jeg enormt positiv over for SF's forslag. Jeg ved ikke, om det rigtige er at lande en beretning på det, eller om det er at sende det til afstemning. Det må ordføreren jo om. Men vi er faktisk meget positive over for nogle af de takter, der ligger i det. For opfindelsen af kunstig intelligens er måske en af de største opdagelser i menneskehedens nyere historie, noget af det, der vil ændre vores samfund allermest i de her år og i de kommende år i særdeleshed. Og der synes jeg og der synes vi i Dansk Folkeparti, at det er meget vigtigt, at der er en stærk politisk lovbaseret regulering – at det ikke er firmaer, der er på den anden side af jordkloden, der får lov til at sætte dagsordenen for, hvad man kan og ikke kan med kunstig intelligens, men at det er noget, hvor vi har noget gennemsigtighed, og også noget, hvor det er demokratiets spilleregler, der er afgørende for, hvordan den her teknologi vil udfolde sig. Det er det ene aspekt i det. Det andet aspekt er, at den vestlige civilisation jo er i en enorm konkurrence med andre civilisationer, der måske tager nogle helt andre hensyn, end vi vil gøre – f.eks. det, der foregår i Kina i de her år, som også buldrer derudad og buldrer fremad, men som har nogle helt andre værdier, man lægger ned over den her nye teknologi. Så min konklusion er, at der er mange gode ting i det her forslag, og det vil vi meget gerne arbejde videre med, og store dele af det kan vi for så vidt også støtte. Tak for ordet.";180.0;15:11:21;8108;7928;2:12:08;2:15:08;41
Magnus Heunicke;Helt grundlæggende er det forureneren, der skal betale, og hvis vi har at gøre med nogen, der forlader et område, sælger et område, hvor de har forurenet, så er det forureneren, der skal betale. Det ville så være rimelig nemt at finde ud af, hvem det er, der har haft området, og hvad det er, der er sket af aktiviteter, som gør, at vi altså nu har en forurening på det her område. Jeg er helt enig i, at midlerne er sparsomme, når vi sidder og forhandler. Dog synes jeg, det var et betragteligt beløb, man afsatte der i 2021. Der er jo også drøftelser af det arbejde, der foregår i vores regioner, med netop at rense op efter generationsforureningerne, og om, hvad der så er behov for. Der er udbud i gang osv. Men jeg vil være meget, meget lydhør over for, hvad det er, eksperterne siger derude, altså hvad det er, der konkret skal se. For nogle steder vurderer de jo, at man ikke skal rydde op i den forurenede jord. Der er ikke noget rent jord at putte i i stedet for, og det er bedre, at den forurening, der er, er indkapslet, end at der bliver ryddet op i den. Det er jo en konkret vurdering, som eksperterne må foretage derude.;68.0;16:15:07;11807;11739;3:15:39;3:16:47;40
Magnus Heunicke;Den her grænse er jo også en grænse, som har været anvendt i de miljørapporter, som er lavet forud, og som branchen jo har været involveret i udarbejdelsen af. Når der så er en bemyndigelse til at gå længere, er det jo, fordi der også er en politisk aftalekreds om den cirkulære ændring af den her branche, og det er den aftalekreds, som selvfølgelig vil blive orienteret om, hvordan udviklingen går, og selvfølgelig også om, hvis vi skal aftale de næste skridt. På den måde er det jo korrekt, at det er ministeren, der så har ansvaret for at udmønte det, der så til den tid formentlig vil være en bekendtgørelse. Men selvfølgelig vil Folketinget blive orienteret, og jeg skal nok også sikre mig, at orienteringen om, hvordan det går, ikke kun er til aftalekredsen, men også til de partier, som ikke er med eller er trådt ud af aftalekredsen, altså en orientering om og en status på, hvordan det går med at få det her løbet i gang.;54.0;14:10:30;4316;4262;1:11:02;1:11:56;40
Erling Bonnesen;Tak for det. Der er et par korte bemærkninger. Jeg skal lige sige, at det er fuldstændig korrekt, at lyset i lampen var gået ud, men jeg kan konstatere, at den lyser igen. Jeg vil i første omgang foreslå, at vi prøver at køre videre, og jeg beder ordføreren lige blive stående, for der er et par korte bemærkninger, og at vi så lige får en lagt 30 sekunder på, hvis det ikke virker. Det er fejlanmeldt, og bare det, at det foreløbig har virket at anmelde den, må vi sige er godt. Vi fortsætter, og der er en kort bemærkning til fru Birgitte Vind.;31.0;15:30:47;9110;9079;2:31:19;2:31:50;40
Erling Bonnesen;Som jeg var inde på før, og det vil jeg henvise til igen, har jeg tillid til, at lovgivningen, og også dem, der sidder og skal lave de faglige vurderinger, selvfølgelig tager højde for ny viden osv., sådan at den viden, der er til rådighed, indgår i at tilvejebringe det beslutningsgrundlag, der skal etableres for at træffe en beslutning om, om der kan laves en parkeringsplads eller et byggeri, eller hvad der kan laves af aktiviteter på den pågældende matrikel, som der ønskes lavet nogle aktiviteter på. Skulle det modsatte vise sig, har ministeren også tilkendegivet, at så kigger vi selvfølgelig på det, men foreløbig har jeg som udgangspunkt tillid til de fagfolk, der tager sig af det.;39.0;16:29:34;12645;12606;3:30:06;3:30:45;40
Erling Bonnesen;Tak for det. Jeg er udmærket bekendt med, at også SF lavede en indsats. Det gør de fleste miljøministre uanset partifarve for at prøve at håndtere nogle af de her problemer. For der er jo ikke nogen, der er uenige i, at sådan nogle forureningsting skal man forsøge at gøre noget ved. Men jeg henviste også sådan bare lige med et passende lille venligt vink til, at selv om SF også har været i regering, var der ikke bare blevet ryddet totalt op. Men vi deler jo alle sammen ambitionen om, at når man deltager i finanslovsforhandlinger, uanset om man er regeringsparti eller oppositionsparti, så prøver man at få mest mulig hastighed på de her ting.;37.0;16:30:56;12725;12688;3:31:28;3:32:05;40
Erling Bonnesen;(Talen er under udarbejdelse);39.0;15:57:27;10718;10679;2:57:59;2:58:38;40
Steffen Larsen;Jeg kan lige starte med at afsløre over for spørgeren, at det, jeg jo nævnte om ældreplejen, var altså ikke signalementer, men bureaukrati. Det er ikke bureaukratiet, der er nødvendigt her, og det er også derfor, at vi ikke støtter det her forslag. Det vil jo lægge en bureaukratisk byrde på politiet, på retsvæsenet og på andre dele af vores retssystem, for den sags skyld, netop at skulle journalisere. Nej, altså, i Liberal Alliance går vi ind for, at der skal være en øget gennemsigtighed, og det ser vi jo, at der er i ret høj grad i Danmark, i forhold til hvad vi ser i nogle af vores nabolande. Man kan også nævne Tyskland som et land, der har haft problemer med den politiske korrekthed på det her område i mange år. Politiet har simpelt hen ikke offentliggjort ordentlige signalementer. Jeg kan jo bare nævne Köln til nytårsaften i 2016 eller 2017, tror jeg det var, hvor vi jo så de samme problemer, nemlig at man ikke kunne fortælle, hvem det var, der havde begået en forbrydelse.;60.0;16:27:21;12534;12474;3:27:54;3:28:54;44
Steffen Larsen;Jeg kan jo følge det lidt op. I Berlingske skriver juristen og direktøren for tænketanken Justitia, at danske regeringer adskillige gange har sluttet op om den amerikanske linje og skrevet under på dokumenter, der slår fast, at blasfemiforbud og begrænsninger af blasfemi er i strid med menneskerettighederne, og som opfordrer alle stater til at ophæve sådanne love. Det er en tilgang, som Danmark har forladt, hvorfor vi har svækket den demokratiske og frihedsorienterede front i en helt afgørende international værdikamp, hvor indsatsen er høj. Maner det ikke også til eftertanke, når vi kan se, at amerikanerne – godt nok i det her led – går ud og siger, at vi gør det modsatte af, hvad vi egentlig selv har skrevet under på og støtter?;43.0;13:11:45;795;752;0:12:32;0:13:15;41
Steffen Larsen;Mange tak, hr. formand. Lad mig bare lige starte med at slå fast, at voldtægt er en modbydelig forbrydelse, ligesom også anklagen om at have begået en voldtægt er et ekstremt indgribende socialt stigma, og det er derfor vigtigt, at vi behandler det her emne med den største alvor. Det er det eneste, ofrene for disse forbrydelser kan være tjent med. Det er vigtigt, at vi her i Folketinget og i samfundet generelt har et højt vidensniveau om forbrydelser, da det kan hjælpe med at forhindre og forebygge kriminalitet. Det er derfor også ønskværdigt, at vidensgrundlaget om voldtægtsforbrydelser forbedres, da det nuværende videngrundlag er gammelt og derudover, at lovgivningen på området er blevet lavet om, så vi står i den situation, at det ikke blot er et gammelt, men også utidssvarende vidensgrundlag, vi står tilbage med. Vi støtter derfor i Liberal Alliance forslaget, da vi har brug for ny viden om, hvad der sker på dette område efter samtykkelovens indførelse og de ændrede adfærdsmønstre, som det i den forbindelse kan have medført. Tak.;67.0;17:23:41;15921;15854;4:24:14;4:25:21;44
Sigurd Agersnap;Tak for ordet, formand. Hvis man følger debatten derhjemme, kan man jo godt få indtrykket af, at det her er en ren ekspeditionssag, og at vi er enige i Folketinget. Det sidste vil jeg bekræfte. Jeg tror, at vi er enige. Selvfølgelig opdaterer vi listen over lande omfattet af danske defensive foranstaltninger i forhold til skattely, når EU's skattelyliste også bliver opdateret. Men jeg vil lige knytte et par ord til EU's liste over skattelylande – dels fordi listen er mangelfuld, dels fordi den faktisk også kan have en effekt. Når listen kan have en effekt, er det jo, fordi den lægger et pres på det enkelte land i forhold til at ændre deres skattelovgivning, så de kan komme af listen igen. Det betyder også, at selv om det må eller vil have konsekvenser for europæiske virksomheder, som har investeret i det land, er man nødt til at gennemføre sanktionerne, for at vi dermed kan presse verdens lande mod større skatteåbenhed og undgå skattelykonstruktioner. Skattely koster samlet set verden over 2.000 mia. kr. Der er forskellige estimater, men det er store beløb, der er i skattely. Så man undgår bl.a. den danske skatteopkrævning, men også skatteopkrævning i en række af verdens udviklingslande. Så det, at vi stadig væk har skattely, hvor man snylter på den samlede skattebetaling, er dybt problematisk, og derfor er det afgørende, at man gennemfører de sanktioner, der følger med EU's skattelyliste. Det andet er så, at EU's liste desværre er stærkt mangelfuld. Det er den først og fremmest, fordi europæiske lande ikke kan optræde på skattelylisten, selv om vi ved fra utallige læk, at der er klare skattely i Europa. Man kan nævne Luxembourg som et af dem. Det er lande, som slår sig op på at sikre, at virksomheder betaler en for lav skat, og ikke udveksler skatteoplysninger med andre europæiske skattemyndigheder, og som derfor på alle måder lever op til kravene til at være på listen over skattelylande. Det bør ændres. Det kan vi ikke gøre her fra Folketinget, for det er et spørgsmål i EU, men deterproblematisk. På samme måde ved vi også, at der er en række skattely uden for EU, som heller ikke er opført på listen. Det er skattely som Cayman Islands og Bermuda, som har utallige læk og utallige eksempler på, at der bliver spekuleret i skatten. Så i SF støtter vi selvfølgelig, at vi opdaterer den danske lovgivning, i forhold til hvad for nogle lande der skal have sanktioner. Det indbefatter, som ordføreren for Venstre, hr. Kim Valentin, siger, selvfølgelig også, at de lande, der nu lever op til kravene, bliver flyttet ud af listen over dem, der skal have sanktioner. Og samtidig er vi stadig kritiske over for, at EU's skattelyliste ikke er fyldestgørende.;149.0;15:34:28;9464;9315;2:35:15;2:37:44;41
Peter Hummelgaard;Tak for ordet. Der er ikke nogen tvivl om, at det kan have og jo har enorme konsekvenser for den enkelte virksomhed eller borgere, som måtte blive udsat for eksempelvis et ransomwareangreb. Politiet har i de senere år oplevet en stor stigning i anmeldelser af sager om it-relateret økonomisk kriminalitet, og samtidig er sagernes kompleksitet steget. Det gælder ikke mindst for sager om ransomwareangreb, hvor gerningspersonerne gemmer sig bag krypterede tjenester og også ofte befinder sig i lande, der kan være svære at samarbejde med. Det er heller ikke nogen hemmelighed, at de seneste års udvikling på området har udfordret politiets håndtering og efterforskning af sager om it-relateret økonomisk kriminalitet. Derfor har vi fra politisk hold også iværksat flere tiltag de seneste år, der generelt skal styrke kampen mod it-relateret kriminalitet. Jeg ved, at politiet også løbende arbejder med at styrke sin indsats på området. Den styrkede indsats omfatter både en styrkelse af sagsbehandlingen af sager om it-relateret kriminalitet og også en styrkelse af den forebyggende indsats på området. Eksempelvis er der som led i en digital tryghedspakke fra efteråret 2022 sket en styrkelse af politiets uddannelsestilbud til efterforskere af sager om bl.a. it-relateret økonomisk kriminalitet. Desuden er politiets sagsbehandling inden for it-relateret økonomisk kriminalitet blevet styrket ved at tilføre yderligere medarbejdere til området. Og herudover har National enhed for Særlig Kriminalitet i foråret 2023 oprettet et responsteam, som skal rykke hurtigt ud i sager om ransomware for at indsamle bevismateriale. Der er således allerede gjort meget på det her område, og Rigspolitiet vurderer, at de tiltag, som er iværksat, også vil løfte bekæmpelsen af it-relateret kriminalitet generelt, og at vi fortsat mangler at se den fulde effekt af de seneste tiltag. Jeg vil ikke udelukke, at der kan være behov for at styrke kampen mod it-relateret kriminalitet yderligere, og det gælder ikke mindst i forhold til forebyggelse, så vi også i videst muligt omfang undgår, at virksomheder og borgere bliver ramt af it-relateret kriminalitet. Tak for ordet.;124.0;13:41:11;2642;2518;0:41:58;0:44:02;41
Preben Bang Henriksen;I § 818, stk. 1, nr. 2, står der, at offentliggørelse skal antages at være af væsentlig betydning for efterforskningen. Det er et efterforskningsredskab, vi har fat i her. De regler, vi har i dag, er ikke regler, der kan anvendes, efter at der er afsagt dom, så på den måde skal der i hvert fald laves om. Lad mig så lige gribe fat i det, som ordføreren sagde om, at man vil have offentliggjort, hvilke typer af mennesker det er. Det får mig bare til at tænke på, hvad der skal stå. Skal der stå, at det var fem danskere? Der er meget andet, for der er også køn og alt muligt andet, der så skal offentliggøres. Skal det offentliggøres, at det er nogle danskere, to nordmænd, fire svenskere og en dansker af den og den højde osv. osv.? Skal alt det beskrives, og hvordan skal domstolene i øvrigt få tid til at lave den beskrivelse? Det samme gælder politiet, som vi fra andre debatter jo også er helt klar over er spændt hårdt for. Det nævnes jo ikke mindst fra spørgerens parti, så jeg kan ikke lige se, at man har tid til det her.;64.0;16:08:17;11394;11330;3:08:50;3:09:54;44
